"created_utc","subreddit","author","domain","url","num_comments","score","ups","downs","title","selftext","saved","id","from_kind","gilded","from","stickied","retrieved_on","over_18","thumbnail","subreddit_id","hide_score","link_flair_css_class","author_flair_css_class","archived","is_self","from_id","permalink","name","author_flair_text","quarantine","link_flair_text","distinguished"
1539505226,"AskSocialScience","kungfu_peasant","self.AskSocialScience","https://www.reddit.com/r/AskSocialScience/comments/9o18at/in_the_absence_of_ethnic_homogeneity_how_do/",3,1,NA,NA,"In the absence of ethnic homogeneity, how do nations evolve common symbols, memories and aspirations- the hallmarks of civic nationalism? Is this kind of nationalism more or less successful than ethnic nationalism in modern times?",NA,NA,"9o18at",NA,0,NA,FALSE,1542601164,FALSE,"self","t5_2sml9",NA,NA,NA,FALSE,TRUE,NA,"/r/AskSocialScience/comments/9o18at/in_the_absence_of_ethnic_homogeneity_how_do/",NA,NA,FALSE,NA,NA
1539507452,"AskSocialScience","Shashank1000","self.AskSocialScience","https://www.reddit.com/r/AskSocialScience/comments/9o1e0f/if_hedge_funds_dont_give_a_higher_rate_of_return/",8,63,NA,NA,"If Hedge Funds don't give a higher rate of return than S&amp;P 500 then why do wealthy individuals and Institutional Investors invest in them?",NA,NA,"9o1e0f",NA,0,NA,FALSE,1542601255,FALSE,"self","t5_2sml9",NA,NA,NA,FALSE,TRUE,NA,"/r/AskSocialScience/comments/9o1e0f/if_hedge_funds_dont_give_a_higher_rate_of_return/",NA,NA,FALSE,NA,NA
1539501806,"AskSocialScience","AndreasWerckmeister","self.AskSocialScience","https://www.reddit.com/r/AskSocialScience/comments/9o0zfj/what_do_lobbyists_actually_do/",9,32,NA,NA,"What do lobbyists actually do?","[removed]",NA,"9o0zfj",NA,0,NA,FALSE,1542601053,FALSE,"default","t5_2sml9",NA,NA,NA,FALSE,TRUE,NA,"/r/AskSocialScience/comments/9o0zfj/what_do_lobbyists_actually_do/",NA,NA,FALSE,NA,NA
1539538350,"AskSocialScience","Contropelo","self.AskSocialScience","https://www.reddit.com/r/AskSocialScience/comments/9o4ln1/george_simmel_what_are_his_most_important/",3,27,NA,NA,"George Simmel: what are his most important contributions to Economic Sociology?","[removed]",NA,"9o4ln1",NA,0,NA,FALSE,1542602755,FALSE,"default","t5_2sml9",NA,NA,NA,FALSE,TRUE,NA,"/r/AskSocialScience/comments/9o4ln1/george_simmel_what_are_his_most_important/",NA,NA,FALSE,NA,NA
1538726633,"AskSocialScience","matthew_record","self.AskSocialScience","https://www.reddit.com/r/AskSocialScience/comments/9lkci3/bibliographic_analysis_on_a_preexisting_set_of/",1,16,NA,NA,"Bibliographic Analysis on a Pre-existing Set of Literature","Hello all!

I use Zotero to organize my citations. I've been working on a literature review and I have manually put together a list of about 100 publications, all organized in Zotero. I would like to find some software that would generate a network map of citations within this pre-existing, provisional bibliography I'm working on so I can get a better idea of the foundational works my lit review is relying upon and see if there's anything I'm missing.

Zotero can output the bibliographic information in a number of formats including BibTex, COins, CSV, XML and RIS among others. I'm wondering if there's a website or bit of software that would allow me to upload my bibliographic information and use that to automatically pull down the citations from my existing lit review and map out the network of citations between them. It doesn't necessarily need to be freeware.

If what I'm describing doesn't exist, does anyone know of a way I could manually re-create my existing list of literature and generate what I'm looking for? I've been trying to do this in Web of Science, but that appears to be built for doing a keyword search and then generating networks based on the search results. No keyword search is going to return exactly the list of literature I'm already working with.

Any insights tremendously appreciated!",NA,"9lkci3",NA,0,NA,FALSE,1542559597,FALSE,"self","t5_2sml9",NA,NA,"pub",FALSE,TRUE,NA,"/r/AskSocialScience/comments/9lkci3/bibliographic_analysis_on_a_preexisting_set_of/",NA,"Public Policy",FALSE,NA,NA
1538748349,"AskSocialScience","AutoModerator","self.AskSocialScience","https://www.reddit.com/r/AskSocialScience/comments/9lmknw/friday_freeforall_october_05_2018/",2,18,NA,NA,"Friday Free-for-All | October 05, 2018","This is for social science related outpourings that are not necessarily questions. Minor questions that you feel don't need or merit their own threads are welcome too. Discovered a great new book, documentary, article, or blog? Has your Ph.D. application been successful? Did you get published? Have you made an sociological discovery while at the supermarket? Did you find an anecdote about Milton Freedman telling a joke to B. F. Skinner? Tell us all about it.

Moderation in this thread will be virtually non-existent -- jokes, anecdotes, and light-hearted banter are welcome.

It's Friday, Friday. Gotta get down on Friday.",NA,"9lmknw",NA,0,NA,FALSE,1542560641,FALSE,"self","t5_2sml9",NA,NA,NA,FALSE,TRUE,NA,"/r/AskSocialScience/comments/9lmknw/friday_freeforall_october_05_2018/",NA,NA,FALSE,NA,"moderator"
1538758643,"AskSocialScience","Meowspacito","self.AskSocialScience","https://www.reddit.com/r/AskSocialScience/comments/9lo2bp/how_did_institutions_emerge_douglass_north/",8,5,NA,NA,"How did institutions emerge? (Douglass North)","Hey.

I really need help in understanding the argument that Douglass North makes in his paper called ""Institutions"". Specifically, could you help me answer how did institutions emerge?

I won't post my own takeaway from the reading so that I would not influence your answers but I need to make sure that I got it right.

Thank you!",NA,"9lo2bp",NA,0,NA,FALSE,1542561335,FALSE,"self","t5_2sml9",NA,NA,NA,FALSE,TRUE,NA,"/r/AskSocialScience/comments/9lo2bp/how_did_institutions_emerge_douglass_north/",NA,NA,FALSE,NA,NA
1538779922,"AskSocialScience","thesubmaster","self.AskSocialScience","https://www.reddit.com/r/AskSocialScience/comments/9lr524/why_do_we_perceive_people_from_a_different/",11,34,NA,NA,"Why do we perceive people from a different nationality as all looking the same?",NA,NA,"9lr524",NA,0,NA,FALSE,1542562770,FALSE,"self","t5_2sml9",NA,NA,NA,FALSE,TRUE,NA,"/r/AskSocialScience/comments/9lr524/why_do_we_perceive_people_from_a_different/",NA,NA,FALSE,NA,NA
1538772377,"AskSocialScience","[deleted]","self.AskSocialScience","https://www.reddit.com/r/AskSocialScience/comments/9lq2jo/is_there_a_current_rising_trend_of_eastern/",0,0,NA,NA,"Is there a current rising trend of Eastern Europeans marrying or intermingling with Asians?","[deleted]",NA,"9lq2jo",NA,0,NA,FALSE,1542562276,FALSE,"default","t5_2sml9",NA,NA,NA,FALSE,TRUE,NA,"/r/AskSocialScience/comments/9lq2jo/is_there_a_current_rising_trend_of_eastern/",NA,NA,FALSE,NA,NA
1538707003,"AskSocialScience","_roldie","self.AskSocialScience","https://www.reddit.com/r/AskSocialScience/comments/9lifwi/why_do_so_many_white_people_care_about_having/",8,8,NA,NA,"Why do so many white people care about having native american ancestry so much, even if it's almost nothing?","[removed]",NA,"9lifwi",NA,0,NA,FALSE,1542558713,FALSE,"default","t5_2sml9",NA,NA,NA,FALSE,TRUE,NA,"/r/AskSocialScience/comments/9lifwi/why_do_so_many_white_people_care_about_having/",NA,NA,FALSE,NA,NA
1538774174,"AskSocialScience","pricklymuffin123","self.AskSocialScience","https://www.reddit.com/r/AskSocialScience/comments/9lqcir/richard_speck_theory/",1,2,NA,NA,"Richard Speck theory","[removed]",NA,"9lqcir",NA,0,NA,FALSE,1542562405,FALSE,"default","t5_2sml9",NA,NA,NA,FALSE,TRUE,NA,"/r/AskSocialScience/comments/9lqcir/richard_speck_theory/",NA,NA,FALSE,NA,NA
1540351403,"AskSocialScience","Experimentalphone","self.AskSocialScience","https://www.reddit.com/r/AskSocialScience/comments/9qw4w9/which_theory_best_explains_why_you_can_live_the/",16,60,NA,NA,"Which theory best explains why you can live the way you want without considering what other people think of you in certain societies and not in others?","So in some societies there are no social rebels. For eg in Bangladesh you cant be openly be a drinker, gambler, partier let alone an alternative lifestyles present in the western world. The loss of your image in society and especially among your peers, relatives is a death sentence. So people take great precautions to hide it or forego it at all. This is even though such lifestyles are legal. 

But in some societies, like the west people don't seem to care what other people will think and openly rebel against norms and live life as they please. 

Is there a name for this phenomenon?
What theories best explain the causes of this? That is what allows people to live their life as they want without thinking what other people will say?  Is this state social security, law and order or what?",NA,"9qw4w9",NA,0,NA,FALSE,1542649558,FALSE,"self","t5_2sml9",NA,NA,NA,FALSE,TRUE,NA,"/r/AskSocialScience/comments/9qw4w9/which_theory_best_explains_why_you_can_live_the/",NA,NA,FALSE,NA,NA
1540395522,"AskSocialScience","NordicSocialDemocrat","self.AskSocialScience","https://www.reddit.com/r/AskSocialScience/comments/9r0qyp/what_policies_have_been_shown_to_reduce/",3,6,NA,NA,"What policies have been shown to reduce likelihood of divorce within low-income couples?","I prefer randomized or natural experiments, but appreciate all relevant info shared :).",NA,"9r0qyp",NA,0,NA,FALSE,1542651724,FALSE,"self","t5_2sml9",NA,NA,NA,FALSE,TRUE,NA,"/r/AskSocialScience/comments/9r0qyp/what_policies_have_been_shown_to_reduce/",NA,NA,FALSE,NA,NA
1540401778,"AskSocialScience","The_Ebb_and_Flow","self.AskSocialScience","https://www.reddit.com/r/AskSocialScience/comments/9r1pe9/is_the_desire_to_reproduce_biological_or_socially/",57,34,NA,NA,"Is the desire to reproduce biological or socially constructed?","Women are often said to have a biological clock, which I'm skeptical of actually existing. To me, it seems humans and other animals generally have a desire to have sex and offspring naturally come as a result, rather than there being an actual biological desire for creating children.",NA,"9r1pe9",NA,0,NA,FALSE,1542652164,FALSE,"self","t5_2sml9",NA,NA,NA,FALSE,TRUE,NA,"/r/AskSocialScience/comments/9r1pe9/is_the_desire_to_reproduce_biological_or_socially/",NA,NA,FALSE,NA,NA
1540411996,"AskSocialScience","aaraujo1973","self.AskSocialScience","https://www.reddit.com/r/AskSocialScience/comments/9r3962/what_was_the_cause_for_the_ideological_change/",6,21,NA,NA,"What was the cause for the ideological change between Democrats and Republicans in the 20th Century?","The Republicans and Democrats had a political realignment with an ideological and regional swap that started in the early 1900s and solidified in the late 1960s.

The Democrats lost the South as it became a Northern and urban party while the Republicans lost the North as it became a Southern and rural party.

The Democratic Party's early history dates back to the South with Presidents Jefferson and Jackson. It's early foundations and ideals were clearly that of the antebellum South. While, the Republican Party's historical foundations are found with the Northern Abolitionists and President Lincoln.

What was the underlying cause for this radical and permanent ideological change? 
",NA,"9r3962",NA,0,NA,FALSE,1542652900,FALSE,"self","t5_2sml9",NA,"resolved",NA,FALSE,TRUE,NA,"/r/AskSocialScience/comments/9r3962/what_was_the_cause_for_the_ideological_change/",NA,NA,FALSE,"Answered",NA
1540382831,"AskSocialScience","[deleted]","self.AskSocialScience","https://www.reddit.com/r/AskSocialScience/comments/9qz1dj/do_you_think_the_ilos_social_protection_floor_is/",0,2,NA,NA,"Do you think the ILO’s Social Protection Floor is fit for purpose ?","[deleted]",NA,"9qz1dj",NA,0,NA,FALSE,1542650918,FALSE,"default","t5_2sml9",NA,NA,NA,FALSE,TRUE,NA,"/r/AskSocialScience/comments/9qz1dj/do_you_think_the_ilos_social_protection_floor_is/",NA,NA,FALSE,NA,NA
1540388655,"AskSocialScience","[deleted]","self.AskSocialScience","https://www.reddit.com/r/AskSocialScience/comments/9qzs92/what_are_the_main_principles_of_conflict_theory/",1,3,NA,NA,"What are the main principles of conflict theory?","[removed]",NA,"9qzs92",NA,0,NA,FALSE,1542651273,FALSE,"default","t5_2sml9",NA,NA,NA,FALSE,TRUE,NA,"/r/AskSocialScience/comments/9qzs92/what_are_the_main_principles_of_conflict_theory/",NA,NA,FALSE,NA,NA
1540389914,"AskSocialScience","AutoModerator","self.AskSocialScience","https://www.reddit.com/r/AskSocialScience/comments/9qzyms/theory_wednesday_october_24_2018/",0,9,NA,NA,"Theory Wednesday | October 24, 2018","[removed]",NA,"9qzyms",NA,0,NA,FALSE,1542651353,FALSE,"default","t5_2sml9",NA,NA,NA,FALSE,TRUE,NA,"/r/AskSocialScience/comments/9qzyms/theory_wednesday_october_24_2018/",NA,NA,FALSE,NA,"moderator"
1538440444,"AskSocialScience","Ventoduck","self.AskSocialScience","https://www.reddit.com/r/AskSocialScience/comments/9km0jb/does_the_variability_hypothesis_hold_water/",19,22,NA,NA,"Does the Variability Hypothesis hold water?","I've recently read dubious claims about this concept (Also defined as Great Variability/Greater Male Variability Hypothesis) which weren't exactly sourced and hyped it up as some sort of ""forbidden knowledge"" suppressed by academic elites. 

Are the claims of the Hypothesis factual or not?",NA,"9km0jb",NA,0,NA,FALSE,1542543460,FALSE,"self","t5_2sml9",NA,NA,NA,FALSE,TRUE,NA,"/r/AskSocialScience/comments/9km0jb/does_the_variability_hypothesis_hold_water/",NA,NA,FALSE,NA,NA
1538476196,"AskSocialScience","TanktopSamurai","self.AskSocialScience","https://www.reddit.com/r/AskSocialScience/comments/9kpgpq/what_effects_the_reaction_to_status_markers_what/",2,34,NA,NA,"What effects the reaction to status markers? What is the difference between Culottes and Jello?","In France, culottes were a type of pants that eventually became associated with the higher class. During the French Revolution, culottes were rejected by the working-class, which gave them their name: ""Les Sans-culottes"". 

In contrast, there is ""Jell-O"".  Jell-O is a brand of gelatin-based dessert. Gelatin is made from collagen through methods that was both prone to failure and time-consuming. Thus, gelatin desserts were eaten by the elites: kings, lords, rich merchants and the like. Eventually new technology reduced the cost of making gelatin and its products. This allowed it to go mainstream and was used extensively by people of all social classes. 

&amp;#x200B;

So what factors play when deciding if a high status marker get rejected or adopted by the other social groups?  What determines if something becomes Jell-O or culottes?",NA,"9kpgpq",NA,0,NA,FALSE,1542545081,FALSE,"self","t5_2sml9",NA,NA,NA,FALSE,TRUE,NA,"/r/AskSocialScience/comments/9kpgpq/what_effects_the_reaction_to_status_markers_what/",NA,NA,FALSE,NA,NA
1538502949,"AskSocialScience","Lilithiumandias","self.AskSocialScience","https://www.reddit.com/r/AskSocialScience/comments/9ksxcm/similarities_and_differences_between_orientalism/",4,5,NA,NA,"Similarities and differences between Orientalism and Ethnocentrism?","Hi, as the title states, I'd like to know the differences and similarities between Orientalism and Ehtnocentrism. Thanks!",NA,"9ksxcm",NA,0,NA,FALSE,1542546702,FALSE,"self","t5_2sml9",NA,NA,NA,FALSE,TRUE,NA,"/r/AskSocialScience/comments/9ksxcm/similarities_and_differences_between_orientalism/",NA,NA,FALSE,NA,NA
1538505185,"AskSocialScience","nico_9","self.AskSocialScience","https://www.reddit.com/r/AskSocialScience/comments/9kt9ic/recommended_reading_for_a_layperson_interested_in/",11,25,NA,NA,"Recommended reading for a layperson interested in cultural narratives?","I'm interested in narratives. Specifically things like political narratives (whether true or untrue) e.g. ""The founding fathers believed x until y years ago, when z ideology began fighting against it and now we are in this age etc. etc. etc."" Any narrative structure that people believe explain what society was like in the past, where it is now, and where it is headed. Is there such thing as a sort of ""narrative analysis"" where one analyzed the scope of a narrative, who the actors are, how the narrative has changed with time, etc.?


I am a layperson with basically no social science background whatsoever. I got interested in this by thinking about reactionary YouTubers (I know, not the best/brightest people) who make claims like ""Western Civilization was like x until liberals came along and now we live in a society that believes y"" and also things like the mythologies surrounding early American political figures (things like Washington and the cherry tree). The thing that most interests me is how their scope may expand e.g. one narrative might be about politics in recent decades but may be changed and modified to tell a story spanning the history of ""Western Civilization"" (I realize that is not a well-defined term).",NA,"9kt9ic",NA,0,NA,FALSE,1542546860,FALSE,"self","t5_2sml9",NA,NA,NA,FALSE,TRUE,NA,"/r/AskSocialScience/comments/9kt9ic/recommended_reading_for_a_layperson_interested_in/",NA,NA,FALSE,NA,NA
1538514280,"AskSocialScience","agatechristie","self.AskSocialScience","https://www.reddit.com/r/AskSocialScience/comments/9kumhf/diversify_hr_to_better_support_workplace_diversity/",5,9,NA,NA,"Diversify HR to better support workplace diversity?","Hi there!   
My company is hiring a new Director of HR, who will be involved both in recruiting new staff and serving existing employees in a HR-capacity. 

I'm on a committee working to promote/support diversity in our workplace, and we came to discuss the identity of the HR Director themselves-- and whether their possession of any marginalized identities should be a factor in our hiring decisions. 

My instinct is yes, but I'm wondering if there's data to support that. 

Are there any studies that evaluate the role of a HR Director's personal identity in influencing corporate culture? This person would have a hand in hiring, shaping diversity &amp; inclusion policies, responding to complaints of sexual harrassment, etc. Could their own ""diversity"" be helpful toward fostering a culture that promotes diversity at work? I think so, but I'd love some evidence :)   
",NA,"9kumhf",NA,0,NA,FALSE,1542547488,FALSE,"self","t5_2sml9",NA,NA,NA,FALSE,TRUE,NA,"/r/AskSocialScience/comments/9kumhf/diversify_hr_to_better_support_workplace_diversity/",NA,NA,FALSE,NA,NA
1538506824,"AskSocialScience","[deleted]","self.AskSocialScience","https://www.reddit.com/r/AskSocialScience/comments/9ktift/most_economists_oppose_rent_control_because_it/",2,7,NA,NA,"Most economists oppose rent control because it negatively impacts the supply of housing, but what about the impact on existing tenants? Is rent control worth it to improve the situation for tenants?","[deleted]",NA,"9ktift",NA,0,NA,FALSE,1542546973,FALSE,"default","t5_2sml9",NA,NA,NA,FALSE,TRUE,NA,"/r/AskSocialScience/comments/9ktift/most_economists_oppose_rent_control_because_it/",NA,NA,FALSE,NA,NA
1538498145,"AskSocialScience","JDurham4635","self.AskSocialScience","https://www.reddit.com/r/AskSocialScience/comments/9ks77o/what_demographics_are_most_into_collecting/",1,1,NA,NA,"What demographics are most into collecting 'digital items' or personalizing avatars?","[removed]",NA,"9ks77o",NA,0,NA,FALSE,1542546351,FALSE,"default","t5_2sml9",NA,NA,NA,FALSE,TRUE,NA,"/r/AskSocialScience/comments/9ks77o/what_demographics_are_most_into_collecting/",NA,NA,FALSE,NA,NA
1540439450,"AskSocialScience","Markdd8","self.AskSocialScience","https://www.reddit.com/r/AskSocialScience/comments/9r6u2h/what_are_we_supposed_to_make_of_this_provocative/",37,9,NA,NA,"What are we supposed to make of this provocative challenge to Grievance Studies (they include gender studies, queer studies, critical whiteness theory, fat studies, sociology) by these self described ""left wing academics?""","These critics use the term ""corruption."" 

https://areomagazine.com/2018/10/02/academic-grievance-studies-and-the-corruption-of-scholarship/  

Quote @ 5:4O:  

&gt;Grievance Studies does not continue the work of the civil rights movement.  It corrupts it.  It trades upon their good names to keep pushing a kind of snake oil upon the public...

*They appear to have put a lot of work into their challenge.  I am not in social science academia.*
",NA,"9r6u2h",NA,0,NA,FALSE,1542654588,FALSE,"self","t5_2sml9",NA,NA,NA,FALSE,TRUE,NA,"/r/AskSocialScience/comments/9r6u2h/what_are_we_supposed_to_make_of_this_provocative/",NA,NA,FALSE,NA,NA
1540461465,"AskSocialScience","shirtlifterdownunder","self.AskSocialScience","https://www.reddit.com/r/AskSocialScience/comments/9r8v0k/broadly_speaking_was_marx_right_in_his_analysis/",248,71,NA,NA,"Broadly speaking, was Marx right in his analysis of capitalism?","Does his work underlie social science in general today? Thanks",NA,"9r8v0k",NA,0,NA,FALSE,1542655547,FALSE,"self","t5_2sml9",NA,NA,NA,FALSE,TRUE,NA,"/r/AskSocialScience/comments/9r8v0k/broadly_speaking_was_marx_right_in_his_analysis/",NA,NA,FALSE,NA,NA
1540504476,"AskSocialScience","benji208","self.AskSocialScience","https://www.reddit.com/r/AskSocialScience/comments/9reqm3/how_to_link_repression_during_social_movements/",1,18,NA,NA,"How to link repression during social movements and radicalism","The umbrella movement (um) saw 3 new youth-led parties which had different methods of resisting the prc. 

One was more confrontational and took part in dangerous high risk events which ended in violence, and was also pro independent.

Another stayed non violent and did not support pro independence (this groups individuals had a leading role in the um)

Another slowly became more and more radical and then became pro independent over time

I am answering why these took different approaches. 

I need a theoretical framework and i need to generate some hypotheses that i can test.
Right now the only theory i have is radical flank effect.
I only have access to their statements and speeches as primary data. 

Would like to ask any good hypotheses that i can test with data? 
",NA,"9reqm3",NA,0,NA,FALSE,1542658308,FALSE,"self","t5_2sml9",NA,NA,NA,FALSE,TRUE,NA,"/r/AskSocialScience/comments/9reqm3/how_to_link_repression_during_social_movements/",NA,NA,FALSE,NA,NA
1540501911,"AskSocialScience","[deleted]","self.AskSocialScience","https://www.reddit.com/r/AskSocialScience/comments/9red5d/does_anybody_know_where_i_could_download_an/",1,2,NA,NA,"Does anybody know where I could download an ""Alternative Uses Test"" for an experiment?","[deleted]",NA,"9red5d",NA,0,NA,FALSE,1542658120,FALSE,"default","t5_2sml9",NA,NA,NA,FALSE,TRUE,NA,"/r/AskSocialScience/comments/9red5d/does_anybody_know_where_i_could_download_an/",NA,NA,FALSE,NA,NA
1538615061,"AskSocialScience","gorbachev","self.AskSocialScience","https://www.reddit.com/r/AskSocialScience/comments/9l79ab/what_factors_help_lead_people_to_commit_murder/",3,14,NA,NA,"What factors help lead people to commit murder? Afterwards, how do they come to terms with it or rationalize the act, or do they not do so?","I would be greatly interested in reading recommendations of a sociological or psychological flavor on the topic. 

As a note, I am not interested in serial killers, mass murders, etc. -- my interest in the topic is solely on the social context around, motivations of, and ex post reasoning of one off (and possibly sporadic) killers. 

Thank you for any suggestions!",NA,"9l79ab",NA,0,NA,FALSE,1542553487,FALSE,"self","t5_2sml9",NA,NA,NA,FALSE,TRUE,NA,"/r/AskSocialScience/comments/9l79ab/what_factors_help_lead_people_to_commit_murder/",NA,NA,FALSE,NA,NA
1538618113,"AskSocialScience","MarkWillis2","self.AskSocialScience","https://www.reddit.com/r/AskSocialScience/comments/9l7mvs/what_are_the_major_schools_of_epistemology_in/",10,20,NA,NA,"What are the major schools of epistemology in social science?","Can you speak to why they disagree? Thanks in advance for your time! It's really hard for me to understand!",NA,"9l7mvs",NA,0,NA,FALSE,1542553656,FALSE,"self","t5_2sml9",NA,NA,NA,FALSE,TRUE,NA,"/r/AskSocialScience/comments/9l7mvs/what_are_the_major_schools_of_epistemology_in/",NA,NA,FALSE,NA,NA
1538635207,"AskSocialScience","ERP_Advocate","self.AskSocialScience","https://www.reddit.com/r/AskSocialScience/comments/9l9hn5/newer_study_into_crime_and_murder_rates_for/",2,1,NA,NA,"New(er) Study Into Crime and Murder Rates for Certain Demographics in America?","Hello all,

&amp;#x200B;

Apologies if I did anything incorrect in asking this, but I recently came across [this study](https://www.bjs.gov/content/pub/pdf/htus8008.pdf) after someone was interested in statistics regarding homicide rates among a certain demographic, and was wondering if it was suitable for citing in conversation today? The study focuses on the years from 1980-2008, meaning it may or may not be comparable to today. If not, is there a study similar to this one which I can look into so I stay informed and can possibly answer other's questions? Oh and if you know of a better place to ask this feel free to let me know either on this post or through PM, Thanks!",NA,"9l9hn5",NA,0,NA,FALSE,1542554535,FALSE,"self","t5_2sml9",NA,NA,NA,FALSE,TRUE,NA,"/r/AskSocialScience/comments/9l9hn5/newer_study_into_crime_and_murder_rates_for/",NA,NA,FALSE,NA,NA
