"created_utc","subreddit","author","domain","url","num_comments","score","ups","downs","title","selftext","saved","id","from_kind","gilded","from","stickied","retrieved_on","over_18","thumbnail","subreddit_id","hide_score","link_flair_css_class","author_flair_css_class","archived","is_self","from_id","permalink","name","author_flair_text","quarantine","link_flair_text","distinguished"
1539390134,"AskSocialScience","FlexPex44","self.AskSocialScience","https://www.reddit.com/r/AskSocialScience/comments/9nplvb/why_do_so_many_social_groups_tribes_fraternities/",12,71,NA,NA,"Why do so many social groups (tribes, fraternities, militaries, teams) have such painful/scary/unpleasant initiation ceremonies?","I noticed a pattern that I don't understand.

&amp;#x200B;

Lots of tribal groups have coming of age ceremonies that are extremely painful or otherwise unpleasant. [There's an amazon tribe where people stick their hands in bullet ants.](https://sites.psu.edu/mgeitnerrcl/2013/11/16/satere-mawe-initiation/) The Masai send their young men to kill a lion with a spear, which sounds pretty dangerous and scary. I know there's lots more examples of coming of age ceremonies that are fucking terrifying.

&amp;#x200B;

Fraternity initiations often involve putting pledges through all kinds of bizarre and humiliating shit. Lots of sports teams and marching bands have had hazing scandals.

&amp;#x200B;

Military boot camp and later training obviously has a practical purpose, but many of the others here don't. Hazing that doesn't have an obvious practical purpose is also pretty common in the military.

&amp;#x200B;

Is this a pattern at all? It seems like a lot of human groups require you to go through some bad shit to become a full member. What is the reason for all of this?

&amp;#x200B;

I also know there are some groups that do not require this. Christian Baptism or Confirmation don't require anything torturous. Why do some groups, but not others, have this pattern?

&amp;#x200B;

EDIT: Wow, some of the most helpful answers got deleted without explanation. Granted, so did the worst.",NA,"9nplvb",NA,0,NA,FALSE,1542595698,FALSE,"self","t5_2sml9",NA,NA,NA,FALSE,TRUE,NA,"/r/AskSocialScience/comments/9nplvb/why_do_so_many_social_groups_tribes_fraternities/",NA,NA,FALSE,NA,NA
1539433192,"AskSocialScience","NikonSeize_dx","self.AskSocialScience","https://www.reddit.com/r/AskSocialScience/comments/9ntcpr/what_references_exist_that_can_inform_to_what/",6,24,NA,NA,"What references exist that can inform to what degree knowledge was (not) shared in communities before specialisation?","I am currently pursuing research in the area of architecture and design, and the question of how past social practices functioned before formal specialisation occured is of interest to me.

From limited readings, I was led to believe that knowledge was shared openly as per necessity, but I am aware that this may also not be the case. What is the current stance in the r/AskSocialScience community regarding the (in)accuracy of this? 

Are there any notable literature references that can shed light on this era before specialisation occured? Or any extended research on how it may inform the context of an increasingly globalised community today with potential for open-source/sharing of knowledge despite progressive specialisation?

Looking forward to your responses as they are much appreciated - and thank you!",NA,"9ntcpr",NA,0,NA,FALSE,1542597464,FALSE,"self","t5_2sml9",NA,NA,NA,FALSE,TRUE,NA,"/r/AskSocialScience/comments/9ntcpr/what_references_exist_that_can_inform_to_what/",NA,NA,FALSE,NA,NA
1539460611,"AskSocialScience","PekoDidNothingWrong","self.AskSocialScience","https://www.reddit.com/r/AskSocialScience/comments/9nwqm9/i_need_important_people_that_writewrote_about/",5,5,NA,NA,"I need important people that write/wrote about discrimination","[removed]",NA,"9nwqm9",NA,0,NA,FALSE,1542599065,FALSE,"default","t5_2sml9",NA,NA,NA,FALSE,TRUE,NA,"/r/AskSocialScience/comments/9nwqm9/i_need_important_people_that_writewrote_about/",NA,NA,FALSE,NA,NA
1540007682,"AskSocialScience","cronos844","self.AskSocialScience","https://www.reddit.com/r/AskSocialScience/comments/9pqyqu/how_malleable_is_a_person_what_can_we_really/",18,27,NA,NA,"How malleable is a person? What can we really change in regards to a person?","This is a really broad question but I’m wondering how effective trying to change others or yourself could be? The implied question is also how can we permanently change a person in some way or another? For example, how effective could therapy be in treating mental disorders, and how much can we ever hope to change, with the temporary use of medication? Would it be possible for a person with autism to be taught or instructed in such a way that they would be able to not have autistic impulses? Furthermore, what can we hope to change for someone with Borderline personality disorder, and/or depression?

Is there any hope?",NA,"9pqyqu",NA,0,NA,FALSE,1542630207,FALSE,"self","t5_2sml9",NA,NA,NA,FALSE,TRUE,NA,"/r/AskSocialScience/comments/9pqyqu/how_malleable_is_a_person_what_can_we_really/",NA,NA,FALSE,NA,NA
1540048262,"AskSocialScience","GetRektRenekton","self.AskSocialScience","https://www.reddit.com/r/AskSocialScience/comments/9puvlp/what_actually_is_gender_sociologically_speaking/",3,23,NA,NA,"What actually is gender, sociologically speaking and otherwise?","In everyday life, we use the concept of gender to describe apparent, important differences between people. We act as though if gender and the ideas of masculinity and femininity are objective, tangible things that have a set definition.

I can see a big problem though in trying to define gender, because there are a handful of exceptions that make a concrete, objective definition tough to support. For the most part, gender seems to be tied to sex and appearance, but neither of those things are really gender themselves. And, given the variation within what we consider male and female, it’s hard to say that gender has a singular trait that defines it. Gender and sex are distinct, but by uncoupling the two, we create problems. I don’t think we can answer whether or not there are more than two genders or effectively solve any other gender-related issues like pronoun stuff until we can actually solve these problems.

Some people have argued that gender is not objective at all, but stems from the mind. In this view, gender is how you view yourself, and doesn’t have to be tied to anything apparent or biological. However, this definition is purely subjective, and doesn’t accurately describe how gender works in real life. Gender is referred to as “socially constructed,” which means that it logically can’t be an individual mental thing. Gender is also strongly tied to sexual orientation, suggesting that any useful, realistic definition of gender HAS to reference something tangible. I think observation of society shows that “assuming” someone’s gender ISN’T a bad thing, or maybe isn’t a thing at all; society uses gender in reference to social and cultural ideas that are tangible and visually apparent. Reality shows that gender is much more than an internal feeling or identification.

The best I’ve been able to say is that gender represents a set of characteristics that are the basis for sexual orientation, and that you know it when you see it. I don’t have a problem with people asking to make an exception to these rules (like saying, “I use they pronouns” if you look female), but I do have a problem with people trying to significantly alter or abolish the rules (like the idea that we need to normalize asking rather than assuming gender; I think gender exists to be assumed if you analyze what it exists).

So, questions:

- Is there a definition of gender? Is gender objective or subjective?
- How does gender relate to appearance, sex, and identity?
- What are the different sociological theories of gender and how do they propose gender to work?
- Are gender frameworks inherently oppressive to those who deviate? I think the binary model works really well in general, and it’s possible to allow people to reject it if they want while keeping its general structure of two primary genders.
- Can we think about gender in a way that respects people’s individual expression, but is also useful and realistic? (I don’t think the “gender = mind gender identity so don’t assume” model is at all accurate for society at large)

First time posting here, and if there’s a better place to get an answer or discuss this, please let me know!",NA,"9puvlp",NA,0,NA,FALSE,1542632046,FALSE,"self","t5_2sml9",NA,NA,NA,FALSE,TRUE,NA,"/r/AskSocialScience/comments/9puvlp/what_actually_is_gender_sociologically_speaking/",NA,NA,FALSE,NA,NA
1540040503,"AskSocialScience","SketchyHippopotamus","self.AskSocialScience","https://www.reddit.com/r/AskSocialScience/comments/9ptyc9/how_do_people_in_extreme_poverty_live_on_a_dollar/",31,49,NA,NA,"How do people in ""extreme poverty"" live on a dollar a day? Is it actually poverty or is self sustaining subsistence farming?",NA,NA,"9ptyc9",NA,0,NA,FALSE,1542631607,FALSE,"self","t5_2sml9",NA,NA,NA,FALSE,TRUE,NA,"/r/AskSocialScience/comments/9ptyc9/how_do_people_in_extreme_poverty_live_on_a_dollar/",NA,NA,FALSE,NA,NA
1539607885,"AskSocialScience","SoybeanCola1933","self.AskSocialScience","https://www.reddit.com/r/AskSocialScience/comments/9ocdyr/wife_assimilating_into_husbands_familyhow_common/",3,30,NA,NA,"Wife assimilating into Husbands family-How common is this today and historically?","In some cultures it appears that upon marriage, the wife is to completely assimilate into her husband's family. She lives with the husband and mixes with his family only. This seems very common in south Asian communities but is it prevalent in other cultures?",NA,"9ocdyr",NA,0,NA,FALSE,1542606421,FALSE,"self","t5_2sml9",NA,NA,NA,FALSE,TRUE,NA,"/r/AskSocialScience/comments/9ocdyr/wife_assimilating_into_husbands_familyhow_common/",NA,NA,FALSE,NA,NA
1539612281,"AskSocialScience","AutoModerator","self.AskSocialScience","https://www.reddit.com/r/AskSocialScience/comments/9ocyfh/monday_reading_and_research_october_15_2018/",2,9,NA,NA,"Monday Reading and Research | October 15, 2018","MONDAY RESEARCH AND READING: Monday Reading and Research will focus on exactly that: the history you have been reading this week and the research you've been working on. It's also the prime thread for requesting books or articles on a particular subject. As with all our weekly features (Theory Wednesdays and Friday Free-For-Alls are the others), this thread will be lightly moderated.

So, encountered an recently that changed article recently that changed how you thought about nationalism? Or pricing? Or anxiety? Cross-cultural communication? Did you have to read a horrendous piece of mumbo-jumbo that snuck through peer-review and want to tell us about how bad it was? Need help finding the literature on topic Y and don't even know how where to start? Is there some new trend in the literature that you're noticing and want to talk about? Then this is the thread for you!
",NA,"9ocyfh",NA,0,NA,FALSE,1542606697,FALSE,"self","t5_2sml9",NA,NA,NA,FALSE,TRUE,NA,"/r/AskSocialScience/comments/9ocyfh/monday_reading_and_research_october_15_2018/",NA,NA,FALSE,NA,"moderator"
1539622977,"AskSocialScience","[deleted]","self.AskSocialScience","https://www.reddit.com/r/AskSocialScience/comments/9oej8q/why_do_we_assume_that_dating_sites_are_full_of/",3,0,NA,NA,"Why do we assume that dating sites are full of ""undesirable"" people?","Putting the safety aspect aside, a lot of people seem to believe that dating sites are full of what I could put it kindly, 'losers'.

But why? Why is it not considered an alternative path towards getting a romantic partner?",NA,"9oej8q",NA,0,NA,FALSE,1542607438,FALSE,"self","t5_2sml9",NA,NA,NA,FALSE,TRUE,NA,"/r/AskSocialScience/comments/9oej8q/why_do_we_assume_that_dating_sites_are_full_of/",NA,NA,FALSE,NA,NA
1539630151,"AskSocialScience","i_post_gibberish","self.AskSocialScience","https://www.reddit.com/r/AskSocialScience/comments/9ofnqp/i_recently_encountered_the_idea_that_almost/",2,15,NA,NA,"I recently encountered the idea that almost everything we experience relies on our concepts about the world, and that people without concepts for things literally do not experience them or experience them very differently. Is this a vindication of Locke’s tabula rasa theory?","I heard this in episode I of the 3rd season of NPR’s psychology podcast *Invisibilia*. They interviewed a psychologist of emotion who says that the new scientific consensus on emotion is that the emotions we feel are based on interpreting internal bodily processes based on the concepts of our culture, so for example what we feel as anger is basically a name we have learned to pin on the feeling of various hormones being released. Her evidence for this is derived from both neuroscience and anthropology. The podcast also mentions that people who gain sight as adults take years to actually see the same things everyone else does because their brain has no circuits for relating patterns of light, dark, and colour to abstract concepts. So for example someone who knows perfectly well what a circle and square feel like can look at both of them and have no idea which is which. It then extends this idea to other things, like how our politics influence the way we see the world and how pernicious stereotypes are. 

As a philosophy student, this seems to me to be very much the Enlightenment view of how we learn (all nurture, essentially no nature), which (at least as far as I know) is now discredited in favour of at least a certain degree of genetic and epigenetic determinism (a mix of nature and nurture). Am I badly misinterpreting the podcast, is it misstating the current consensus about how vision and emotion work, or have we in fact returned to viewing humans as blank slates at birth?",NA,"9ofnqp",NA,0,NA,FALSE,1542607965,FALSE,"self","t5_2sml9",NA,NA,NA,FALSE,TRUE,NA,"/r/AskSocialScience/comments/9ofnqp/i_recently_encountered_the_idea_that_almost/",NA,NA,FALSE,NA,NA
1539636730,"AskSocialScience","Lilithiumandias","self.AskSocialScience","https://www.reddit.com/r/AskSocialScience/comments/9ogp6o/what_does_marx_and_engles_mean_by_calling_workers/",1,4,NA,NA,"What does Marx and Engles mean by calling workers the ""grave diggers"" of capitalism?","And how does commidty fetishism play into this?",NA,"9ogp6o",NA,0,NA,FALSE,1542608461,FALSE,"self","t5_2sml9",NA,NA,NA,FALSE,TRUE,NA,"/r/AskSocialScience/comments/9ogp6o/what_does_marx_and_engles_mean_by_calling_workers/",NA,NA,FALSE,NA,NA
1539634481,"AskSocialScience","Senray","self.AskSocialScience","https://www.reddit.com/r/AskSocialScience/comments/9ogciq/does_viewing_media_of_military_homecomings_affect/",1,43,NA,NA,"Does viewing media of military homecomings affect support for war, and if yes, what direction is the effect?",NA,NA,"9ogciq",NA,0,NA,FALSE,1542608276,FALSE,"self","t5_2sml9",NA,NA,NA,FALSE,TRUE,NA,"/r/AskSocialScience/comments/9ogciq/does_viewing_media_of_military_homecomings_affect/",NA,NA,FALSE,NA,NA
1539637180,"AskSocialScience","dormirbeaute","self.AskSocialScience","https://www.reddit.com/r/AskSocialScience/comments/9ogrpi/questions_for_a_relocation/",2,1,NA,NA,"Questions for a relocation","[removed]",NA,"9ogrpi",NA,0,NA,FALSE,1542608493,FALSE,"default","t5_2sml9",NA,NA,NA,FALSE,TRUE,NA,"/r/AskSocialScience/comments/9ogrpi/questions_for_a_relocation/",NA,NA,FALSE,NA,NA
1538964410,"AskSocialScience","emmazunz84","self.AskSocialScience","https://www.reddit.com/r/AskSocialScience/comments/9mavip/why_so_many_purple_states/",5,13,NA,NA,"Why so many purple states?","Why do so many states elect senators of both parties, or senators and governors of both parties? E.g. VT has blue senators and a red governor.",NA,"9mavip",NA,0,NA,FALSE,1542571999,FALSE,"self","t5_2sml9",NA,NA,NA,FALSE,TRUE,NA,"/r/AskSocialScience/comments/9mavip/why_so_many_purple_states/",NA,NA,FALSE,NA,NA
1538964478,"AskSocialScience","lobobricord","self.AskSocialScience","https://www.reddit.com/r/AskSocialScience/comments/9mavt7/did_the_satanic_ritual_abuse_moral_panic_really/",17,55,NA,NA,"Did the ""satanic ritual abuse"" moral panic really end or has it continued until this day?","I've been fascinated by reading about the daycare child abuse and satanic ritual abuse moral panics of the 1980s.

But one thing that seems wrong to me is the description of the panic as something that occurred and then was more or less debunked and ended.

To me it seems like the idea that there is constant ongoing ritual child sexual abuse, and shadowy rings that perpetrate it in a coordinated way, has become a pretty accepted thing in popular and political culture in a way that seems linked to the panics of the 1980s. The pizzagate conspiracy theory is an obvious parallel, as are (more controversially maybe) some fears around child sex trafficking, societal fascination with pedophilia media like To Catch a Predator, etc.

Is anyone aware of research attempting to understand this as a kind of decades-long moral panic related to children, sex, and abuse? As someone who isn't a social scientist my suspicion is that it seems related to anxieties about changing family structure, weakening of patriarchy, decline of religion and all that kind of stuff in the late 20th-21st century. 

As a bonus question: The most real and regular instances of child sexual abuse have been found in the Catholic church, but it seems like that abuse is not at all the focus of this kind of moral panic. Why is that?",NA,"9mavt7",NA,0,NA,FALSE,1542572003,FALSE,"self","t5_2sml9",NA,NA,NA,FALSE,TRUE,NA,"/r/AskSocialScience/comments/9mavt7/did_the_satanic_ritual_abuse_moral_panic_really/",NA,NA,FALSE,NA,NA
1538981867,"AskSocialScience","RAV0004","self.AskSocialScience","https://www.reddit.com/r/AskSocialScience/comments/9mcn33/american_politics_why_dont_democrats_support/",6,7,NA,NA,"[American Politics] Why don't Democrats support Republican single issue voters? Who's stopping them?","A lot of people say that most if not all Republican voters care about single issue topics, such as abortion, gun control, LGBT rights, immigration, etc. If this were really the case, couldn't the Democratic party simply steal the Republican stance? Where would all the LGBT, Anti-gun, pro-choice people go? If they made a new party, it would split the Democratic vote and Republicans would probably win again. What if the Democratic party dropped each of these issues one by one instead of all at once? Would that reduce the outrage? I honestly feel like they could get away with this. What am I missing? Is Republican single issue voting just hyperbole?",NA,"9mcn33",NA,0,NA,FALSE,1542572814,FALSE,"self","t5_2sml9",NA,NA,NA,FALSE,TRUE,NA,"/r/AskSocialScience/comments/9mcn33/american_politics_why_dont_democrats_support/",NA,NA,FALSE,NA,NA
1539007545,"AskSocialScience","AutoModerator","self.AskSocialScience","https://www.reddit.com/r/AskSocialScience/comments/9mf4wn/monday_reading_and_research_october_08_2018/",0,1,NA,NA,"Monday Reading and Research | October 08, 2018","MONDAY RESEARCH AND READING: Monday Reading and Research will focus on exactly that: the history you have been reading this week and the research you've been working on. It's also the prime thread for requesting books or articles on a particular subject. As with all our weekly features (Theory Wednesdays and Friday Free-For-Alls are the others), this thread will be lightly moderated.

So, encountered an recently that changed article recently that changed how you thought about nationalism? Or pricing? Or anxiety? Cross-cultural communication? Did you have to read a horrendous piece of mumbo-jumbo that snuck through peer-review and want to tell us about how bad it was? Need help finding the literature on topic Y and don't even know how where to start? Is there some new trend in the literature that you're noticing and want to talk about? Then this is the thread for you!
",NA,"9mf4wn",NA,0,NA,FALSE,1542573979,FALSE,"self","t5_2sml9",NA,NA,NA,FALSE,TRUE,NA,"/r/AskSocialScience/comments/9mf4wn/monday_reading_and_research_october_08_2018/",NA,NA,FALSE,NA,"moderator"
1539010391,"AskSocialScience","Iskandar11","self.AskSocialScience","https://www.reddit.com/r/AskSocialScience/comments/9mfj77/has_there_ever_been_rigorous_mathematical_models/",12,54,NA,NA,"Has there ever been rigorous mathematical models/ analysis of Marxist economics? Where can I read commentary on their models/ analysis?","My Marxist economics I mean, analysis/ models directly from his writings, not on Marxist economist interpretations that came after.",NA,"9mfj77",NA,0,NA,FALSE,1542574161,FALSE,"self","t5_2sml9",NA,NA,NA,FALSE,TRUE,NA,"/r/AskSocialScience/comments/9mfj77/has_there_ever_been_rigorous_mathematical_models/",NA,NA,FALSE,NA,NA
1539019943,"AskSocialScience","LUClEN","self.AskSocialScience","https://www.reddit.com/r/AskSocialScience/comments/9mgzm2/to_what_extent_could_modern_liberalismleftist/",2,0,NA,NA,"To what extent could modern liberalism/leftist political ideologies be connected to previous efforts to oppose social darwinism?","One of the most consistent differences between leftists and rightists, from what I can glean, is our difference in how we view individual responsibility and the extent to which people ought to compete for the desired things in life. For the left, those who are unable to be competitive do not deserve to just die out. For many on the right, if you are unable to take care of yourself, that is a sign that you are unfit for modern life. 

Social Darwinism initially started out as a kind of liberal endeavour: Well-off, Canadian Suffragettes supported it in my home country during its early spread. The idea fell out of favour among that group, for the most part, and instead, it became a useful perspective lens for more economically minded people, finding a nice, snug home among the political right. 

For those of you with good knowledge in intellectual histories, to what extent can this chasm between the current bipartisan mode of politics be connected to that initial shift in thinking among the intellectual elite?",NA,"9mgzm2",NA,0,NA,FALSE,1542574852,FALSE,"self","t5_2sml9",NA,NA,NA,FALSE,TRUE,NA,"/r/AskSocialScience/comments/9mgzm2/to_what_extent_could_modern_liberalismleftist/",NA,NA,FALSE,NA,NA
1539010172,"AskSocialScience","[deleted]","self.AskSocialScience","https://www.reddit.com/r/AskSocialScience/comments/9mfi2n/has_there_ever_been_a_rigorous_mathematical/",0,1,NA,NA,"Has there ever been a rigorous mathematical models/ analysis of Marxist economics? Where can I read commentary on their models/ analysis?","[deleted]",NA,"9mfi2n",NA,0,NA,FALSE,1542574147,FALSE,"default","t5_2sml9",NA,NA,NA,FALSE,TRUE,NA,"/r/AskSocialScience/comments/9mfi2n/has_there_ever_been_a_rigorous_mathematical/",NA,NA,FALSE,NA,NA
1539000437,"AskSocialScience","Wayward_Distraction","self.AskSocialScience","https://www.reddit.com/r/AskSocialScience/comments/9me9rv/effects_of_religious_background_on_dating/",2,2,NA,NA,"Effects of religious background on dating?","[removed]",NA,"9me9rv",NA,0,NA,FALSE,1542573575,FALSE,"default","t5_2sml9",NA,NA,NA,FALSE,TRUE,NA,"/r/AskSocialScience/comments/9me9rv/effects_of_religious_background_on_dating/",NA,NA,FALSE,NA,NA
1539009319,"AskSocialScience","andersonlab","self.AskSocialScience","https://www.reddit.com/r/AskSocialScience/comments/9mfdq0/contribute_to_research/",1,5,NA,NA,"Contribute to Research!","[removed]",NA,"9mfdq0",NA,0,NA,FALSE,1542574090,FALSE,"default","t5_2sml9",NA,NA,NA,FALSE,TRUE,NA,"/r/AskSocialScience/comments/9mfdq0/contribute_to_research/",NA,NA,FALSE,NA,NA
1538784884,"AskSocialScience","Mjjjokes","self.AskSocialScience","https://www.reddit.com/r/AskSocialScience/comments/9lrpm6/are_there_any_documented_examples_of_community/",2,0,NA,NA,"Are there any documented examples of community activism (and development) improving communities?","Also, what are some good community activism and development organizations to study?",NA,"9lrpm6",NA,0,NA,FALSE,1542563044,FALSE,"self","t5_2sml9",NA,NA,NA,FALSE,TRUE,NA,"/r/AskSocialScience/comments/9lrpm6/are_there_any_documented_examples_of_community/",NA,NA,FALSE,NA,NA
1538786312,"AskSocialScience","ICG-Studios","self.AskSocialScience","https://www.reddit.com/r/AskSocialScience/comments/9lrvb1/what_are_some_coolpopular_theories_or_ideas/",6,7,NA,NA,"What are some cool/popular theories or ideas regarding the social construction of reality?","I know the basic ones like self fulfilling prophecy and Thomas theorem but are there any more really cool ones? 

It would be cool to see some related to sociology, psychology, linguistics, etc

I find it really interesting to think that many of our actions and realities are based around social constructs",NA,"9lrvb1",NA,0,NA,FALSE,1542563117,FALSE,"self","t5_2sml9",NA,NA,NA,FALSE,TRUE,NA,"/r/AskSocialScience/comments/9lrvb1/what_are_some_coolpopular_theories_or_ideas/",NA,NA,FALSE,NA,NA
