"created_utc","subreddit","author","domain","url","num_comments","score","ups","downs","title","selftext","saved","id","from_kind","gilded","from","stickied","retrieved_on","over_18","thumbnail","subreddit_id","hide_score","link_flair_css_class","author_flair_css_class","archived","is_self","from_id","permalink","name","author_flair_text","quarantine","link_flair_text","distinguished"
1538369583,"AskSocialScience","[deleted]","self.AskSocialScience","https://www.reddit.com/r/AskSocialScience/comments/9kdesl/questions_regarding_kohlbergs_model_of_moral/",14,0,NA,NA,"Questions regarding Kohlbergs model of moral reasoning","
The gist of [Kohlberg's model](http://www.qcc.cuny.edu/SocialSciences/ppecorino/MEDICAL_ETHICS_TEXT/Chapter_2_Ethical_Traditions/Reading-Barger-on-Kohlberg.htm)


||||
|:--:|:--:|:--:|
|    LEVEL    |       STAGE    |         SOCIAL ORIENTATION |
|Pre-conventional    |  1   |         Obedience and Punishment|
| |                  |  2   |      Individualism, Instrumentalism, and Exchange |
|Conventional    |    3         |       ""Good boy/girl"" |
||                      4          |       Law and Order |
|Post-conventional  |   5      |          Social Contract |
||                      6        |      Principled Conscience |

The question regards the contrast between stages 3 and 6. 

A social-psyche treatment looks at stage 3 as the moral reasoning character of 'conventional society', while the form of moral reasoning seen at stage 6 is a distinctly different worldview. 

Cultural norms are taught and maintained at the formal level of logical complexity. see: [Commons MHC](https://www.learning-theories.com/model-hierarchical-complexity.html) 

Stage 3 conventional society happens at a formal level of logical complexity. 

---------

&amp;nbsp; 

The issue here is that I expect many social scientists to have differing opinions on what is or should be considered 'normal' for conventional society. 

Even you're not familiar with the Kohlberg model you can understand that some people are more adherent  to a pro-social emotional repertoire than others, and also some people are more adherent to a strict interpretations of sentence logic. 

Kohlberg's stage 6 profile is scalable in complexity, but when it's at a higher level than formal, it's distinctly a very different form of logic.  

One who has a pro-social emotional repertoire, adheres to strict interpretations of sentence logic, has an understanding of development stages, and how the ranges of moral reasoning are transmitted within the social order, has a unique perspective on a 'bigger picture' gestalt.  


---------

&amp;nbsp; 

With all that context, the questions become: 

##When do you consider society is moral enough?  

##When do you consider society is not moral enough? 

##Why should we trust people who maintain a relatively systemically violent culture (ex: school shootings/militarism) to serve the psychological needs of the people? 

##By what mechanism do you understand this scope of social relevence?

#What should academic social science do to address the present school shooting epidemic?",NA,"9kdesl",NA,0,NA,FALSE,1542539459,FALSE,"self","t5_2sml9",NA,NA,NA,FALSE,TRUE,NA,"/r/AskSocialScience/comments/9kdesl/questions_regarding_kohlbergs_model_of_moral/",NA,NA,FALSE,NA,NA
1538402740,"AskSocialScience","AutoModerator","self.AskSocialScience","https://www.reddit.com/r/AskSocialScience/comments/9kgm2i/monday_reading_and_research_october_01_2018/",0,5,NA,NA,"Monday Reading and Research | October 01, 2018","MONDAY RESEARCH AND READING: Monday Reading and Research will focus on exactly that: the history you have been reading this week and the research you've been working on. It's also the prime thread for requesting books or articles on a particular subject. As with all our weekly features (Theory Wednesdays and Friday Free-For-Alls are the others), this thread will be lightly moderated.

So, encountered an recently that changed article recently that changed how you thought about nationalism? Or pricing? Or anxiety? Cross-cultural communication? Did you have to read a horrendous piece of mumbo-jumbo that snuck through peer-review and want to tell us about how bad it was? Need help finding the literature on topic Y and don't even know how where to start? Is there some new trend in the literature that you're noticing and want to talk about? Then this is the thread for you!
",NA,"9kgm2i",NA,0,NA,FALSE,1542540945,FALSE,"self","t5_2sml9",NA,NA,NA,FALSE,TRUE,NA,"/r/AskSocialScience/comments/9kgm2i/monday_reading_and_research_october_01_2018/",NA,NA,FALSE,NA,"moderator"
1538407080,"AskSocialScience","Iskandar11","self.AskSocialScience","https://www.reddit.com/r/AskSocialScience/comments/9kh84o/what_are_some_of_your_favorite_nontextbook/",43,51,NA,NA,"What are some of your favorite non-textbook, economics books?","Besides Freakonomics, I've already read it.",NA,"9kh84o",NA,0,NA,FALSE,1542541242,FALSE,"self","t5_2sml9",NA,NA,NA,FALSE,TRUE,NA,"/r/AskSocialScience/comments/9kh84o/what_are_some_of_your_favorite_nontextbook/",NA,NA,FALSE,NA,NA
1538413696,"AskSocialScience","Casting_Aspersions","self.AskSocialScience","https://www.reddit.com/r/AskSocialScience/comments/9ki7kh/looking_for_literature_on_how_new_functions_are/",5,1,NA,NA,"Looking for literature on how new functions are established in companies (e.g., data science, user experience, marketing, etc.) Any folks in Sociology, Business, Organizational Psych, etc. have any good leads?","Hi r/AskSocialScience,

Hoping some folks from the Sociology of Work/Labor, Business, Org Psych, etc. world can help with this.

I'm trying to find research that looks at how new business functions emerge and are then adopted (e.g., marketing, data science, user experience). My theory is that this often happens first through consultancies and then as trust builds (and the commodification of process takes over?), these functions start to move in-house.  Would love to see if that dynamic has been studied in other disciplines. 

Just wondering if anyone knows of some good literature or references on this or similar, adjacent topics.

Thanks!
",NA,"9ki7kh",NA,0,NA,FALSE,1542541685,FALSE,"self","t5_2sml9",NA,NA,NA,FALSE,TRUE,NA,"/r/AskSocialScience/comments/9ki7kh/looking_for_literature_on_how_new_functions_are/",NA,NA,FALSE,NA,NA
1538416574,"AskSocialScience","albacore_futures","self.AskSocialScience","https://www.reddit.com/r/AskSocialScience/comments/9kinhk/books_papers_on_the_1848_revolutions/",1,7,NA,NA,"Books / Papers on the 1848 revolutions?","I'm interested in learning more about the Europe-wide 1848 revolutions, and would welcome books or scholarly articles you'd recommend.",NA,"9kinhk",NA,0,NA,FALSE,1542541905,FALSE,"self","t5_2sml9",NA,NA,NA,FALSE,TRUE,NA,"/r/AskSocialScience/comments/9kinhk/books_papers_on_the_1848_revolutions/",NA,NA,FALSE,NA,NA
1538352913,"AskSocialScience","DiscussingExtremism","self.AskSocialScience","https://www.reddit.com/r/AskSocialScience/comments/9kbg6i/the_phenomenon_of_violent_extremism/",0,3,NA,NA,"The Phenomenon of Violent Extremism","[removed]",NA,"9kbg6i",NA,0,NA,FALSE,1542536954,FALSE,"default","t5_2sml9",NA,NA,NA,FALSE,TRUE,NA,"/r/AskSocialScience/comments/9kbg6i/the_phenomenon_of_violent_extremism/",NA,NA,FALSE,NA,NA
1538369456,"AskSocialScience","Billyjackkickass","self.AskSocialScience","https://www.reddit.com/r/AskSocialScience/comments/9kdec6/what_if_we_closed_the_united_states_on_sundays/",2,0,NA,NA,"What if we closed the United States on Sunday’s? Obviously not emergency services, but everything else.","[removed]",NA,"9kdec6",NA,0,NA,FALSE,1542539454,FALSE,"default","t5_2sml9",NA,NA,NA,FALSE,TRUE,NA,"/r/AskSocialScience/comments/9kdec6/what_if_we_closed_the_united_states_on_sundays/",NA,NA,FALSE,NA,NA
1538412011,"AskSocialScience","sometimespenises","self.AskSocialScience","https://www.reddit.com/r/AskSocialScience/comments/9khydz/has_japans_xenophobia_affected_it_negatively_in/",2,1,NA,NA,"Has Japan's xenophobia affected it negatively in recent times?","[removed]",NA,"9khydz",NA,0,NA,FALSE,1542541571,FALSE,"default","t5_2sml9",NA,NA,NA,FALSE,TRUE,NA,"/r/AskSocialScience/comments/9khydz/has_japans_xenophobia_affected_it_negatively_in/",NA,NA,FALSE,NA,NA
1538431259,"AskSocialScience","goodstudent007","self.AskSocialScience","https://www.reddit.com/r/AskSocialScience/comments/9kktro/theories_of_juvenile_delinquencies_in_laymans/",1,1,NA,NA,"theories of juvenile delinquencies, in layman's terms","[removed]",NA,"9kktro",NA,0,NA,FALSE,1542542907,FALSE,"default","t5_2sml9",NA,NA,NA,FALSE,TRUE,NA,"/r/AskSocialScience/comments/9kktro/theories_of_juvenile_delinquencies_in_laymans/",NA,NA,FALSE,NA,NA
1539832200,"AskSocialScience","SSAJS","self.AskSocialScience","https://www.reddit.com/r/AskSocialScience/comments/9p5ex5/protestant_ethic_vs_calvinism/",5,17,NA,NA,"Protestant Ethic vs Calvinism?","So these two terms have been mind-boggling for me. So to my understanding...PE came first, and then Calvinism came after, taking the philosophy of PE basically and making it into a religion. 

However, wasn't PE already involving God? So wouldn't PE inherently be...a religion so-to-speak? I am just confused about the significant distinction between PE and Calvinism X\_X",NA,"9p5ex5",NA,0,NA,FALSE,1542620076,FALSE,"self","t5_2sml9",NA,NA,NA,FALSE,TRUE,NA,"/r/AskSocialScience/comments/9p5ex5/protestant_ethic_vs_calvinism/",NA,NA,FALSE,NA,NA
1539855410,"AskSocialScience","MyStolenCow","self.AskSocialScience","https://www.reddit.com/r/AskSocialScience/comments/9p7q47/in_what_ways_does_the_russian_revolution_shapes/",2,50,NA,NA,"In what ways does the Russian Revolution shapes the world today, even after the fall of communism?","In particular, I'm curious about the Russian Revolution's role in decolonization of the 20th century, self determination movements, as a counter narrative to capitalism. I wonder is it still relevant even after the fall of communism.",NA,"9p7q47",NA,0,NA,FALSE,1542621167,FALSE,"self","t5_2sml9",NA,NA,NA,FALSE,TRUE,NA,"/r/AskSocialScience/comments/9p7q47/in_what_ways_does_the_russian_revolution_shapes/",NA,NA,FALSE,NA,NA
1539883482,"AskSocialScience","LankaRunAway","self.AskSocialScience","https://www.reddit.com/r/AskSocialScience/comments/9pbc6a/why_are_some_people_inconsiderate/",1,1,NA,NA,"Why are some people inconsiderate?","What makes people not care about others? Why are some more considerate of others and others not ?

Not sure if this is the best place to ask this question, but i want a deep answer to this question.",NA,"9pbc6a",NA,0,NA,FALSE,1542622872,FALSE,"self","t5_2sml9",NA,NA,NA,FALSE,TRUE,NA,"/r/AskSocialScience/comments/9pbc6a/why_are_some_people_inconsiderate/",NA,NA,FALSE,NA,NA
1539898389,"AskSocialScience","Kalzone4","self.AskSocialScience","https://www.reddit.com/r/AskSocialScience/comments/9pdhxw/literature_suggestions_critical_theory_applied_to/",0,23,NA,NA,"Literature suggestions: Critical theory applied to the EU","I’m trying to find for some literature regarding critical theory in the context of power hegemony. Specifically I am looking for a theoretical framework to use to analyze the EU accession process to determine whether/to what extent a hegemonic relationship is reproduced through the conditionalities of the accession process. 

Any suggestions are welcomed!",NA,"9pdhxw",NA,0,NA,FALSE,1542623869,FALSE,"self","t5_2sml9",NA,NA,NA,FALSE,TRUE,NA,"/r/AskSocialScience/comments/9pdhxw/literature_suggestions_critical_theory_applied_to/",NA,NA,FALSE,NA,NA
1539902240,"AskSocialScience","Hadrius","self.AskSocialScience","https://www.reddit.com/r/AskSocialScience/comments/9pe0w0/what_language_is_easiest_to_adopt_as_a_first/",22,31,NA,NA,"What language is easiest to adopt as a *first* language?","Is there a meaningful difference in the speed and fluency of primary language adoption? If there is, which language(s) are considered the most difficult to adopt as a primary language? The easiest?

&amp;#x200B;

I've struggled for some time to find any answers to these questions, so any insights would be appreciated :)",NA,"9pe0w0",NA,0,NA,FALSE,1542624131,FALSE,"self","t5_2sml9",NA,NA,NA,FALSE,TRUE,NA,"/r/AskSocialScience/comments/9pe0w0/what_language_is_easiest_to_adopt_as_a_first/",NA,NA,FALSE,NA,NA
1539906198,"AskSocialScience","wrallin","self.AskSocialScience","https://www.reddit.com/r/AskSocialScience/comments/9pejbx/sports_diplomacy_origins_theory_and_practice/",0,0,NA,NA,"Sports Diplomacy: Origins, Theory and Practice","[removed]",NA,"9pejbx",NA,0,NA,FALSE,1542624364,FALSE,"default","t5_2sml9",NA,NA,NA,FALSE,TRUE,NA,"/r/AskSocialScience/comments/9pejbx/sports_diplomacy_origins_theory_and_practice/",NA,NA,FALSE,NA,NA
1540755283,"AskSocialScience","WanderingKing","self.AskSocialScience","https://www.reddit.com/r/AskSocialScience/comments/9s5zlu/is_there_actually_more_racistantisemetic_actions/",8,67,NA,NA,"Is there actually more racist/antisemetic actions going on, or is it just being reported more?","I ask because I often hear people say ""crime is through the roof"" even though it is, by most measures as I understand it, down. The problem is that more of it gets reported, making it APPEAR like there is more.

Is there any info regarding racism/antisemtism over the 10 years?

Thanks!",NA,"9s5zlu",NA,0,NA,FALSE,1542671125,FALSE,"self","t5_2sml9",NA,NA,NA,FALSE,TRUE,NA,"/r/AskSocialScience/comments/9s5zlu/is_there_actually_more_racistantisemetic_actions/",NA,NA,FALSE,NA,NA
1540704530,"AskSocialScience","potatoesinstock","self.AskSocialScience","https://www.reddit.com/r/AskSocialScience/comments/9s0yqw/how_accurate_are_the_commonly_brought_up/",20,39,NA,NA,"How accurate are the commonly brought up assertions from feminists (for example commonality of rape, wage gap) and men's rights activists (for example more domestic victims male, higher suicide)?",NA,NA,"9s0yqw",NA,0,NA,FALSE,1542668767,FALSE,"self","t5_2sml9",NA,NA,NA,FALSE,TRUE,NA,"/r/AskSocialScience/comments/9s0yqw/how_accurate_are_the_commonly_brought_up/",NA,NA,FALSE,NA,NA
1540612907,"AskSocialScience","Not_Brandon","self.AskSocialScience","https://www.reddit.com/r/AskSocialScience/comments/9rrg7e/what_can_explain_the_rise_in_popularity_of_xanax/",30,58,NA,NA,"What can explain the rise in popularity of Xanax in America's youth drug culture?","Ten years ago rappers weren't rapping about Xanax, much less naming themselves after it (Lil Xan). When I went to rehab eight years ago nobody was there for Xanax. Prescription drug dealers had it, but people I knew weren't all that excited about it. I'm in rehab again and it seems like everyone under the age of twenty five used it. It's a favorite of the latest generation of rappers, and a lot of them have it in their systems when they overdose and die. It's not a new drug, and as far as I know it hasn't suddenly become more accessible (correct me if I'm wrong). Is there something about the specific profile of alprazolam, or benzodiazepines in general, that resonates with today's young drug users in a way that it didn't with the people I used with eight or ten years ago?",NA,"9rrg7e",NA,0,NA,FALSE,1542664279,FALSE,"self","t5_2sml9",NA,NA,NA,FALSE,TRUE,NA,"/r/AskSocialScience/comments/9rrg7e/what_can_explain_the_rise_in_popularity_of_xanax/",NA,NA,FALSE,NA,NA
1540632633,"AskSocialScience","MisterJose","self.AskSocialScience","https://www.reddit.com/r/AskSocialScience/comments/9rt1ks/are_there_any_core_aspects_to_spotting_people/",10,4,NA,NA,"Are there any core aspects to spotting people spreading inaccurate information?","I'm a musician, with a music degree, and although I'm primarily an instrumentalist, I also was in the chorus in college. Last year I started taking singing lessons. At first I debated with my teacher, and was skeptical about certain ideas she was claiming about singing and singing technique. I had heard different from so many different sources. 

After much debate, discussion, and just generally a year-long learning process, I now feel I have a solid handle on what is legitimate advice, backed up by study and evidence, and what is nonsense. Turns out, most of the 'singing teachers' on YouTube who have the most hits and subscribers? Yeah, they're full of it. 

You can find good knowledge, like [this guy](https://youtu.be/yNjF-F_3qvo), for example, and if you listen to him and compare him to the flashier and more exciting videos of those he criticizes, you can see part of the problem. And of course just look at his view count compared to those others as well.

So, my point is that it took me this decent chunk of time, effort, and desire for truth to be able to get to a place where I can spot the legit from the fake *in some section of a field of study I already have a degree in!* How is there hope for others who are completely uneducated to be able to do the same? Or for me to do the same in another field, like physics, or economics, or climate science?

This seems to be an incredibly deep problem where we live in a world where we're dependent on expertise, but left without ways of telling legitimate expertise from illegitimate hackery. We can't expect everyone to read and digest the climate studies at the level an expert in the field would. So how are those people supposed to tell? A PhD doesn't guarantee someone isn't full of it. Seeing them cite a study or use charts/graphs is far from full-proof. Majorities certainly aren't always right either. So what can you do? Are there any solid methods of determining these things, or at least determining who is *probably* correct, without knowledge in a given field?

",NA,"9rt1ks",NA,0,NA,FALSE,1542665029,FALSE,"self","t5_2sml9",NA,NA,NA,FALSE,TRUE,NA,"/r/AskSocialScience/comments/9rt1ks/are_there_any_core_aspects_to_spotting_people/",NA,NA,FALSE,NA,NA
1540653582,"AskSocialScience","Zam8859","self.AskSocialScience","https://www.reddit.com/r/AskSocialScience/comments/9rv0t2/us_punitive_vs_norwegian_rehabilitative_prison/",9,43,NA,NA,"US Punitive vs Norwegian Rehabilitative Prison Systems","How do you think the history of these two nations have affected the prison systems each holds? It's clear that the recidivism rates in the US are over double that of Norway, yet the US has made minimal progress towards a proper rehabilitative prison system. What historical and racial factors could play into this and what social function does the US prison system serve (if it isn't reducing crime) in comparison to Norway's?",NA,"9rv0t2",NA,0,NA,FALSE,1542665958,FALSE,"self","t5_2sml9",NA,NA,NA,FALSE,TRUE,NA,"/r/AskSocialScience/comments/9rv0t2/us_punitive_vs_norwegian_rehabilitative_prison/",NA,NA,FALSE,NA,NA
1540653723,"AskSocialScience","smadgerano","self.AskSocialScience","https://www.reddit.com/r/AskSocialScience/comments/9rv1gq/have_there_been_any_studies_on_how_global_warming/",1,6,NA,NA,"Have there been any studies on how global warming is affecting psychology on a personal, social or global scale?","Title kinda says it all, but recently I've been trying to work out some of the behavior I see in society, and wondered if the ""impending doom""  of global warming (a claim, that for the first time in our history has a scientific basis rather than a religious one) has anything to do with it.

New to this sub, and to the sociology world in general so apologies if my language and framing isn't up to scratch, just after knowledge and my first thought was reddit :)",NA,"9rv1gq",NA,0,NA,FALSE,1542665966,FALSE,"self","t5_2sml9",NA,NA,NA,FALSE,TRUE,NA,"/r/AskSocialScience/comments/9rv1gq/have_there_been_any_studies_on_how_global_warming/",NA,NA,FALSE,NA,NA
1539519747,"AskSocialScience","BooniedDog85","self.AskSocialScience","https://www.reddit.com/r/AskSocialScience/comments/9o2bc4/why_do_so_many_people_with_knowledge_of_foreign/",6,0,NA,NA,"Why do so many people with knowledge of foreign cultures (especially professional experts) seem to only know the traditional conservative aspects, the 2% class, and to a much lesser extent the biggest artistic achievements? How come they are often ignorant of commoner stuff?","I notice when many book smart people who profess knowledge of foreign cultures memorize all sorts of really intricate stuff from the proper poetic grammer of speaking the language at its most educated and eloquent levels to the dress styles and types of clothing that is often deemed as ""traditional"" to folk music and dances and religious custom. Basically they learn much of the complexities of a culture........ But on its most traditional and conservative. I note though much of them are so ignorant on what more specific stuff like how Tokyo has different mannerisms due to its congestion and heavy work life compared to say Kyoto. Worse yet they are even more ignorant of whats mainstream in the foreign culture they have so much knowledge about especially what the average Joe does in daily life an more importantly what a random commoner does and enjoys on a day-to-day basis (especially when you take into account social classes, regions, subcultures like Otakus, even differences in one neighborhood block from another and minor disasters thathappen in a small apartment block such as murders, explosions, etc).

To use as an example while most Hispanists and other scholars and lovers of Latin America would be able to explains the dances of Peruvian Indians or the major economic trends of Ecuador in the 90s and how the Federalists won the Mexican Revolution of the 20th century, they are quite ignorant of how Saint Seiya took Latin America by storm especially Mexico and was overall the most beloved anime/manga in the continent especially in Mexico (where it singlehandedly launch the popularity of anime/manga in the country and still remains a beloved childhood memory and most popular classic in the country). Saint Seiya along with DBZ and Sailor Moon were practically everything any kid with a television watched every Saturday and everyday once reruns began and merchandise sold like Twinkies for much of the 90s. Its almost impossible to see an adult with an average childhood who grew up in the 90s who had not watched all those 3 shows once. At the minimal even someone who didn't grow up with TV from the commoners stock at least can recognize one of those anime because of everyday conversations at school.

Another example is how history books on 90s Britain barely mention anything about soccer and only list stuff such as Margaret Thatcher not running another term and terrorist attacks, etc. In particular the comment about Thatcher amused since they often write about how relieved the British populace was about Thatcher not running another term. I lived with my mom at various points in the UK during the 90s and trust me most people in the city I lived in in Scotland was not cheering or holding parties, etc. In fact most people at the bar or in the playgrounds, etc were more concerned about just going on in their daily lives. I heard much more conversation about local farm profits, beer, the diseased sheeps, college sports, etc than anything about Thatcher, terrorist attacks, Arafat's visit to Britain shown on the news (I was there when I saw the meeting and discussions,), and the construction of the Millennium Dome. Only even I remember that shooke veryone in my town was the death of Princess Diana and even that was forgotten shortly after despite how news Media kept talking about it for months after she died.

There are too many examples to list from how the cinema of Turkey is rarely discussed by Turcophiles to the daily junk food Greeks commonly eat (especially beloved brand chips) or how Israel as its share of underground computer gaming scene that paid more attention to FPS tournaments than what was happening during the brief invasion of Lebanon. How can so many fans and experts of foreign countries and exotic cultures memorize the details such as how traditional hats are made but ignore that most people spend more time just chilling in their own favorite hobbies such as the local Rap scene or their own Americanophile groups who spend more time watching American movies than reading their country's classic literature and studying traditional dances? How can they not be aware of the most popular soap opera in Russia despite the fact they can pay attention to what's Putin is doing and memorize facts of various major cities and regions in Russia? While we're at it how come none of them ever bother memorizing the local villages and less significant cities of Russia, something that Russian themselves would know especially surrounding towns and city near a Russian's home? Or of the most recent top 20s in Algeria's music chart?

Can anyone explain this of why people with philia and/knowledge of a foreign country or another culture memorize traditional stuff mostly forgotten or barely known by the general populace such and major events like terrorist attacks in Ireland that most Irish people don't know about (and even those who saw it live on the news when it was happening had already forgotten about)? But they don't bother learning about how well Fendi is doing as a company in England, who was voted most hottest guy in Sweden last year, or the fact most Zoroastrians don't do fire rituals on a daily basis but instead are too busy working to put food on the table?",NA,"9o2bc4",NA,0,NA,FALSE,1542601678,FALSE,"self","t5_2sml9",NA,NA,NA,FALSE,TRUE,NA,"/r/AskSocialScience/comments/9o2bc4/why_do_so_many_people_with_knowledge_of_foreign/",NA,NA,FALSE,NA,NA
