"created_utc","subreddit","author","domain","url","num_comments","score","ups","downs","title","selftext","saved","id","from_kind","gilded","from","stickied","retrieved_on","over_18","thumbnail","subreddit_id","hide_score","link_flair_css_class","author_flair_css_class","archived","is_self","from_id","permalink","name","author_flair_text","quarantine","link_flair_text","distinguished"
1538676906,"AskSocialScience","NoTooth9","self.AskSocialScience","https://www.reddit.com/r/AskSocialScience/comments/9leeee/where_can_i_learn_diagonal_reference/",0,20,NA,NA,"Where can I learn Diagonal Reference Model/Diagonal Mobility Model?","Hi,  I am a social sciences phd student at my uni. I am interested in using a diagonal reference model\* (also known as diagonal mobility model) to assess the effect of mobility on moral worldviews. Unfortunately, none of the professors at my uni are familiar/have used this model before. I tried Google searching learning materials and looking for a book on Amazon, but I have had no luck. So, I was wondering if anyone here could point me in the right direction? The clearer/easier to under the better. Thank you for your help!

&amp;#x200B;

\*The model was developed by Michael Sobel: [Diagonal Mobility Models: A Substantively Motivated Class of Designs for the Analysis of Mobility Effects](https://www.jstor.org/stable/2095086?seq=1#metadata_info_tab_contents)

&amp;#x200B;

For a more recent application, see [Statistical challenges in modelling the health consequences of social mobility: the need for diagonal reference models](https://link.springer.com/article/10.1007/s00038-017-1018-x)

&amp;#x200B;

&amp;#x200B;",NA,"9leeee",NA,0,NA,FALSE,1542556828,FALSE,"self","t5_2sml9",NA,NA,NA,FALSE,TRUE,NA,"/r/AskSocialScience/comments/9leeee/where_can_i_learn_diagonal_reference/",NA,NA,FALSE,NA,NA
1538639743,"AskSocialScience","FatLook","self.AskSocialScience","https://www.reddit.com/r/AskSocialScience/comments/9l9vle/do_we_have_proof_of_psychedelic_usage_leading_to/",17,21,NA,NA,"Do we have proof of psychedelic usage leading to some religions?",NA,NA,"9l9vle",NA,0,NA,FALSE,1542554714,FALSE,"self","t5_2sml9",NA,NA,NA,FALSE,TRUE,NA,"/r/AskSocialScience/comments/9l9vle/do_we_have_proof_of_psychedelic_usage_leading_to/",NA,NA,FALSE,NA,NA
1538680241,"AskSocialScience","bongcouver","self.AskSocialScience","https://www.reddit.com/r/AskSocialScience/comments/9lewgj/hoax_studies_in_the_social_sciences/",31,16,NA,NA,"Hoax studies in the social sciences","[removed]",NA,"9lewgj",NA,0,NA,FALSE,1542557059,FALSE,"default","t5_2sml9",NA,NA,NA,FALSE,TRUE,NA,"/r/AskSocialScience/comments/9lewgj/hoax_studies_in_the_social_sciences/",NA,NA,FALSE,NA,NA
1539080429,"AskSocialScience","oftencoffee","self.AskSocialScience","https://www.reddit.com/r/AskSocialScience/comments/9mnyar/where_can_i_learn_more_about_ngos_and_their/",5,13,NA,NA,"Where can I learn more about NGO's and their effect on socio-economical development?","I unfortunately never understood what exactly NGO's do, how they do it and at the end does it make any difference at all. I would like to read more about NGO's, what kinds are there, what they do, and how effective they are in terms of socio-economical development.

I would also like to learn more about alternative organization models (besides NGO's and governmental institutions) that would contribute to societal change.",NA,"9mnyar",NA,0,NA,FALSE,1542578094,FALSE,"self","t5_2sml9",NA,NA,NA,FALSE,TRUE,NA,"/r/AskSocialScience/comments/9mnyar/where_can_i_learn_more_about_ngos_and_their/",NA,NA,FALSE,NA,NA
1539113484,"AskSocialScience","asscactus","self.AskSocialScience","https://www.reddit.com/r/AskSocialScience/comments/9ms8sr/discourse_or_content_analysis_to_answer_my/",8,22,NA,NA,"Discourse or Content Analysis to answer my research questions?","I've been looking into the foundations of discourse and content analysis and am beginning to understand the methodologies, but am having trouble seeing which approach is more appropriate given my questions and potential data.

I am looking to understand what is meant by a certain phrase [""iconic species""] and how it is used in different texts, including scientific articles, nonprofit websites, and in popular press. 


As a part of this, I want counts and summaries of the context surrounding the phrase (what species the phrase refers to, article titles, author affiliations, etc.). However, my assumptions align more with discourse analysis in which meaning of that concept [iconic species] is constructed by the discourse in which the phrase is used. So far I've only seen reference to quantitative tools in content analysis. Can anyone help me sort this out?",NA,"9ms8sr",NA,0,NA,FALSE,1542580092,FALSE,"self","t5_2sml9",NA,NA,NA,FALSE,TRUE,NA,"/r/AskSocialScience/comments/9ms8sr/discourse_or_content_analysis_to_answer_my/",NA,NA,FALSE,NA,NA
1539089198,"AskSocialScience","PM-ME-LAIN","self.AskSocialScience","https://www.reddit.com/r/AskSocialScience/comments/9mou2g/is_there_any_research_looking_at_how_effectively/",15,70,NA,NA,"Is there any research looking at how effectively biases are combated by being aware of them?",NA,NA,"9mou2g",NA,0,NA,FALSE,1542578514,FALSE,"self","t5_2sml9",NA,NA,NA,FALSE,TRUE,NA,"/r/AskSocialScience/comments/9mou2g/is_there_any_research_looking_at_how_effectively/",NA,NA,FALSE,NA,NA
1539091289,"AskSocialScience","[deleted]","self.AskSocialScience","https://www.reddit.com/r/AskSocialScience/comments/9mp387/is_it_true_rapists_start_killing_their_victims_to/",1,1,NA,NA,"Is it true rapists start killing their victims to prevent witnesses, in places the punishment for their crime is too harsh?","[deleted]",NA,"9mp387",NA,0,NA,FALSE,1542578631,FALSE,"default","t5_2sml9",NA,NA,NA,FALSE,TRUE,NA,"/r/AskSocialScience/comments/9mp387/is_it_true_rapists_start_killing_their_victims_to/",NA,NA,FALSE,NA,NA
1539057211,"AskSocialScience","clixclax","self.AskSocialScience","https://www.reddit.com/r/AskSocialScience/comments/9mlwnv/any_development_studies_majors/",1,0,NA,NA,"Any development studies majors?","[removed]",NA,"9mlwnv",NA,0,NA,FALSE,1542577138,FALSE,"default","t5_2sml9",NA,NA,NA,FALSE,TRUE,NA,"/r/AskSocialScience/comments/9mlwnv/any_development_studies_majors/",NA,NA,FALSE,NA,NA
1539074794,"AskSocialScience","dumpsterprince","self.AskSocialScience","https://www.reddit.com/r/AskSocialScience/comments/9mnh75/what_would_you_say_is_the_best_approach_to/",6,4,NA,NA,"What would you say is the best approach to dealing with a nuclear North Korea and Iran?","[removed]",NA,"9mnh75",NA,0,NA,FALSE,1542577880,FALSE,"default","t5_2sml9",NA,NA,NA,FALSE,TRUE,NA,"/r/AskSocialScience/comments/9mnh75/what_would_you_say_is_the_best_approach_to/",NA,NA,FALSE,NA,NA
1539085667,"AskSocialScience","[deleted]","self.AskSocialScience","https://www.reddit.com/r/AskSocialScience/comments/9mofwg/looking_for_expert_participants_to_answer/",1,2,NA,NA,"Looking for expert participants to answer research questions on State security and the use of drones","[removed]",NA,"9mofwg",NA,0,NA,FALSE,1542578316,FALSE,"default","t5_2sml9",NA,NA,NA,FALSE,TRUE,NA,"/r/AskSocialScience/comments/9mofwg/looking_for_expert_participants_to_answer/",NA,NA,FALSE,NA,NA
1539091434,"AskSocialScience","walle637","self.AskSocialScience","https://www.reddit.com/r/AskSocialScience/comments/9mp3uv/no_one_in_five_women_has_not_been_raped/",1,0,NA,NA,"No, One in Five Women Has Not Been Raped","[removed]",NA,"9mp3uv",NA,0,NA,FALSE,1542578640,FALSE,"default","t5_2sml9",NA,NA,NA,FALSE,TRUE,NA,"/r/AskSocialScience/comments/9mp3uv/no_one_in_five_women_has_not_been_raped/",NA,NA,FALSE,NA,NA
1539116939,"AskSocialScience","[deleted]","self.AskSocialScience","https://www.reddit.com/r/AskSocialScience/comments/9msqwe/an_anonymous_online_survey_for_a_mobile_safety/",1,1,NA,NA,"An anonymous online survey for a mobile safety application to combat public sexual harassment (PP who live in the USA)","[removed]",NA,"9msqwe",NA,0,NA,FALSE,1542580341,FALSE,"default","t5_2sml9",NA,NA,NA,FALSE,TRUE,NA,"/r/AskSocialScience/comments/9msqwe/an_anonymous_online_survey_for_a_mobile_safety/",NA,NA,FALSE,NA,NA
1539180317,"AskSocialScience","AutoModerator","self.AskSocialScience","https://www.reddit.com/r/AskSocialScience/comments/9mzr4m/theory_wednesday_october_10_2018/",4,26,NA,NA,"Theory Wednesday | October 10, 2018","Theory Wednesday topics include:

* Social science in academia

* Famous debates

* Questions about methods and data sources

* Philosophy of social science

* and so on.

Do you wonder about choosing a dissertation topic? Finding think tank work? Want to learn about natural language processing? Have a question about the academic applications of Marxian theories or social network analysis? The history of a theory? This is the place!

Like our other feature threads (Monday Reading and Research and Friday Free-For-All), this thread will be lightly moderated as long as it stays broadly on topics tangentially related to academic or professional social science.
",NA,"9mzr4m",NA,0,NA,FALSE,1542583603,FALSE,"self","t5_2sml9",NA,NA,NA,FALSE,TRUE,NA,"/r/AskSocialScience/comments/9mzr4m/theory_wednesday_october_10_2018/",NA,NA,FALSE,NA,"moderator"
1539206959,"AskSocialScience","[deleted]","self.AskSocialScience","https://www.reddit.com/r/AskSocialScience/comments/9n3qbh/older_redditors_50_of_the_us_does_now_truly_feel/",1,1,NA,NA,"Older redditors (50+) of the US, does now truly feel like the most politically divided time in our recent history?","[deleted]",NA,"9n3qbh",NA,0,NA,FALSE,1542585455,FALSE,"default","t5_2sml9",NA,NA,NA,FALSE,TRUE,NA,"/r/AskSocialScience/comments/9n3qbh/older_redditors_50_of_the_us_does_now_truly_feel/",NA,NA,FALSE,NA,NA
1539133330,"AskSocialScience","[deleted]","self.AskSocialScience","https://www.reddit.com/r/AskSocialScience/comments/9muxfw/content_analysis_for_different_time_periods/",0,1,NA,NA,"Content analysis for different time periods","[removed]",NA,"9muxfw",NA,0,NA,FALSE,1542581355,FALSE,"default","t5_2sml9",NA,NA,NA,FALSE,TRUE,NA,"/r/AskSocialScience/comments/9muxfw/content_analysis_for_different_time_periods/",NA,NA,FALSE,NA,NA
1539154866,"AskSocialScience","[deleted]","self.AskSocialScience","https://www.reddit.com/r/AskSocialScience/comments/9mx7my/survey_for_people_who_wear_glasses_purchasing/",1,0,NA,NA,"Survey for people who wear glasses purchasing behaviour","[removed]",NA,"9mx7my",NA,0,NA,FALSE,1542582410,FALSE,"default","t5_2sml9",NA,NA,NA,FALSE,TRUE,NA,"/r/AskSocialScience/comments/9mx7my/survey_for_people_who_wear_glasses_purchasing/",NA,NA,FALSE,NA,NA
1539185957,"AskSocialScience","sovietnickie","self.AskSocialScience","https://www.reddit.com/r/AskSocialScience/comments/9n0k6z/need_school_help_the_culture_industry_of_the_1988/",1,1,NA,NA,"Need School Help: The Culture Industry of the 1988 film They Live","[removed]",NA,"9n0k6z",NA,0,NA,FALSE,1542583987,FALSE,"default","t5_2sml9",NA,NA,NA,FALSE,TRUE,NA,"/r/AskSocialScience/comments/9n0k6z/need_school_help_the_culture_industry_of_the_1988/",NA,NA,FALSE,NA,NA
1539193431,"AskSocialScience","NikonSeize_dx","self.AskSocialScience","https://www.reddit.com/r/AskSocialScience/comments/9n1ox2/what_references_exist_for_early_societies_having/",8,36,NA,NA,"What references exist for early societies having an ""open-source"" approach to knowledge (i.e. before specialisation)?","[removed]",NA,"9n1ox2",NA,0,NA,FALSE,1542584516,FALSE,"default","t5_2sml9",NA,NA,NA,FALSE,TRUE,NA,"/r/AskSocialScience/comments/9n1ox2/what_references_exist_for_early_societies_having/",NA,NA,FALSE,NA,NA
1539246928,"AskSocialScience","[deleted]","self.MoralAtheists","https://www.reddit.com/r/MoralAtheists/comments/9n829m/questions_for_social_science_what_is_moral_grammar/",0,0,NA,NA,"Questions for Social Science | What Is Moral Grammar?",NA,NA,"9n843i",NA,0,NA,FALSE,1542587511,FALSE,"default","t5_2sml9",NA,NA,NA,FALSE,FALSE,NA,"/r/AskSocialScience/comments/9n843i/questions_for_social_science_what_is_moral_grammar/",NA,NA,FALSE,NA,NA
1539275809,"AskSocialScience","[deleted]","self.AskSocialScience","https://www.reddit.com/r/AskSocialScience/comments/9nbjrl/where_do_the_democrats_and_republicans_differ_on/",1,0,NA,NA,"Where do the Democrats and Republicans differ on foreign policy?","[deleted]",NA,"9nbjrl",NA,0,NA,FALSE,1542589105,FALSE,"default","t5_2sml9",NA,NA,NA,FALSE,TRUE,NA,"/r/AskSocialScience/comments/9nbjrl/where_do_the_democrats_and_republicans_differ_on/",NA,NA,FALSE,NA,NA
1539283694,"AskSocialScience","Sweanix","self.AskSocialScience","https://www.reddit.com/r/AskSocialScience/comments/9ncpoq/will_the_creation_of_cgi_fashion_models_reduce/",6,8,NA,NA,"Will the creation of CGI fashion models reduce the mental health issues young people have from the unrealistic standards of human models? (Link to story in comments)","[removed]",NA,"9ncpoq",NA,0,NA,FALSE,1542589647,FALSE,"default","t5_2sml9",NA,NA,NA,FALSE,TRUE,NA,"/r/AskSocialScience/comments/9ncpoq/will_the_creation_of_cgi_fashion_models_reduce/",NA,NA,FALSE,NA,NA
1539283904,"AskSocialScience","TheZoidberg5766","self.AskSocialScience","https://www.reddit.com/r/AskSocialScience/comments/9ncqt2/could_someone_explain_world_society_theory/",8,0,NA,NA,"Could someone explain World Society Theory?","[removed]",NA,"9ncqt2",NA,0,NA,FALSE,1542589662,FALSE,"default","t5_2sml9",NA,NA,NA,FALSE,TRUE,NA,"/r/AskSocialScience/comments/9ncqt2/could_someone_explain_world_society_theory/",NA,NA,FALSE,NA,NA
1539296795,"AskSocialScience","[deleted]","self.AskSocialScience","https://www.reddit.com/r/AskSocialScience/comments/9nelxt/question_about_the_icd_and_paraphilias/",1,1,NA,NA,"Question about the ICD and paraphilias","[removed]",NA,"9nelxt",NA,0,NA,FALSE,1542590544,FALSE,"default","t5_2sml9",NA,NA,NA,FALSE,TRUE,NA,"/r/AskSocialScience/comments/9nelxt/question_about_the_icd_and_paraphilias/",NA,NA,FALSE,NA,NA
1540858033,"AskSocialScience","bootscallahan","self.AskSocialScience","https://www.reddit.com/r/AskSocialScience/comments/9sis1a/prewidespread_internet_how_did_rumors_and_urban/",8,24,NA,NA,"Pre-widespread internet, how did rumors and urban legends about celebrities spread so far and wide (e.g. the Richard Gere gerbil story)?","Another I remember is that Mark-Paul Gossellar was killed in a car crash after Tiffany-Amber Thiessen broke up with him in real life. I remember hearing it and telling other people, but how did that untrue story make its way to my grade school in Oklahoma in the early 90s?",NA,"9sis1a",NA,0,NA,FALSE,1542677126,FALSE,"self","t5_2sml9",NA,NA,NA,FALSE,TRUE,NA,"/r/AskSocialScience/comments/9sis1a/prewidespread_internet_how_did_rumors_and_urban/",NA,NA,FALSE,NA,NA
1540925270,"AskSocialScience","Lilithiumandias","self.AskSocialScience","https://www.reddit.com/r/AskSocialScience/comments/9sqtb3/why_are_runon_sentences_so_common_in_academic/",46,65,NA,NA,"Why are run-on sentences so common in academic articles?","I feel like this may be a stupid question, but as a medical sociology and anthropology student, I read and use various academic articles in the social sciences. I've noticed that a lot of scholar's sentences are extremely long, e.g., in Durganand Sinha's *Culture and Psychology: Perspective of Cross-Cultural Psychology.* Sentences, such as in this specific text, seem to go on for an entire paragraph. I doubt it's because I've missed the periods, as I've read this text extensively for a paper I was writing. I'm asking this question because for my entire life, my professors have always docked marks for run on sentences, however, it appears that scholar's like Sinha use them freely. Why is this?",NA,"9sqtb3",NA,0,NA,FALSE,1542768978,FALSE,"self","t5_2sml9",NA,NA,NA,FALSE,TRUE,NA,"/r/AskSocialScience/comments/9sqtb3/why_are_runon_sentences_so_common_in_academic/",NA,NA,FALSE,NA,NA
1540931508,"AskSocialScience","jackal567","self.AskSocialScience","https://www.reddit.com/r/AskSocialScience/comments/9srrfp/why_does_halloween_exist_what_is_its_cultural/",1,1,NA,NA,"Why does Halloween Exist? What is its Cultural Function?","Hello everyone; Halloween is my favorite holiday and I fall more in love with it every year.  

I for one have always thought that ideally, Halloween is the time where we bring what we are afraid of out of the shadows and/or flip our society upside down and be someone else you could never be any other day.   

I also subscribe to that sociological theory that Halloween is a secular, subconscious effort by the West to create its own trickster figure, its own Loki, its own outlier holiday to teach us not to take life too seriously, just like how trickster gods of old taught their peoples to not take their religions too seriously.  

But I thought it would be appropriate to ask everyone what your thoughts are. What IS Halloween, from the view of social science?",NA,"9srrfp",NA,0,NA,FALSE,1542769488,FALSE,"self","t5_2sml9",NA,NA,NA,FALSE,TRUE,NA,"/r/AskSocialScience/comments/9srrfp/why_does_halloween_exist_what_is_its_cultural/",NA,NA,FALSE,NA,NA
1538550027,"AskSocialScience","Markdd8","self.AskSocialScience","https://www.reddit.com/r/AskSocialScience/comments/9kyuuf/is_there_evidence_that_mens_persistently_poor/",14,0,NA,NA,"Is there evidence that men's persistently poor behavior towards women leads (or has led) a significant number of women to ""swear off"" men (cliche) and enter into significant-other relationships with other women?","Either platonically or a relationship involving sex?  And is there statistical info here?  *ETA:  If we enter the factors of bisexuality and gender fluidity.* 

Men's persistently poor behavior toward women is a generalization, but based on the widespread sentiment this past year from the MeToo movement, there is much basis for it.

And looking back in history, one can further generalize that whatever men's shortcomings have been in the past 4-5 decades, the situation was infinitely worse in many if not most places of the world pre-1900.

 - - - -

Excerpt:

&gt;It is only recently that domestic violence has been considered a violation of the law. Although men have battered, abused and mistreated their wives or intimate partners for a long time, historically, wife or partner abuse has been viewed as a ""normal"" part of marriage or intimate relationships....

&gt;The English common law, in the name of the protection of the family, provided husbands the right to chastise their wives only ""moderately"". It excluded death (Blackstone, 1987, p. 177). The English law, which was brought to the American colonies, allowed husbands to retain their right to physically chastise their wives, as long as they did not use a stick larger than their thumb (the origin of the expression ""the rule of thumb"").   

*(Interesting trivia in this unfortunate account.)*

http://ojin.nursingworld.org/MainMenuCategories/ANAMarketplace/ANAPeriodicals/OJIN/TableofContents/Volume72002/No1Jan2002/DomesticViolenceandCriminalJustice.html",NA,"9kyuuf",NA,0,NA,FALSE,1542549455,FALSE,"self","t5_2sml9",NA,NA,NA,FALSE,TRUE,NA,"/r/AskSocialScience/comments/9kyuuf/is_there_evidence_that_mens_persistently_poor/",NA,NA,FALSE,NA,NA
1538575574,"AskSocialScience","AutoModerator","self.AskSocialScience","https://www.reddit.com/r/AskSocialScience/comments/9l1gns/theory_wednesday_october_03_2018/",5,17,NA,NA,"Theory Wednesday | October 03, 2018","Theory Wednesday topics include:

* Social science in academia

* Famous debates

* Questions about methods and data sources

* Philosophy of social science

* and so on.

Do you wonder about choosing a dissertation topic? Finding think tank work? Want to learn about natural language processing? Have a question about the academic applications of Marxian theories or social network analysis? The history of a theory? This is the place!

Like our other feature threads (Monday Reading and Research and Friday Free-For-All), this thread will be lightly moderated as long as it stays broadly on topics tangentially related to academic or professional social science.
",NA,"9l1gns",NA,0,NA,FALSE,1542550677,FALSE,"self","t5_2sml9",NA,NA,NA,FALSE,TRUE,NA,"/r/AskSocialScience/comments/9l1gns/theory_wednesday_october_03_2018/",NA,NA,FALSE,NA,"moderator"
1538538769,"AskSocialScience","[deleted]","self.AskSocialScience","https://www.reddit.com/r/AskSocialScience/comments/9kxqrv/how_does_social_construction_differ_from_the_mind/",17,23,NA,NA,"How does social construction differ from the mind as a ""blank slate"" or behaviorism?",NA,NA,"9kxqrv",NA,0,NA,FALSE,1542548938,FALSE,"self","t5_2sml9",NA,NA,NA,FALSE,TRUE,NA,"/r/AskSocialScience/comments/9kxqrv/how_does_social_construction_differ_from_the_mind/",NA,NA,FALSE,NA,NA
1538595552,"AskSocialScience","armin199","self.AskSocialScience","https://www.reddit.com/r/AskSocialScience/comments/9l4k7f/do_animals_have_ritual_or_is_ritual_a/",18,54,NA,NA,"Do animals have ritual, or is ritual a specifically human phenomenon?",NA,NA,"9l4k7f",NA,0,NA,FALSE,1542552134,FALSE,"self","t5_2sml9",NA,NA,NA,FALSE,TRUE,NA,"/r/AskSocialScience/comments/9l4k7f/do_animals_have_ritual_or_is_ritual_a/",NA,NA,FALSE,NA,NA
1538537312,"AskSocialScience","[deleted]","self.AskSocialScience","https://www.reddit.com/r/AskSocialScience/comments/9kxkx5/need_research_method_help_pls/",4,4,NA,NA,"Need Research method help pls","[removed]",NA,"9kxkx5",NA,0,NA,FALSE,1542548865,FALSE,"default","t5_2sml9",NA,NA,NA,FALSE,TRUE,NA,"/r/AskSocialScience/comments/9kxkx5/need_research_method_help_pls/",NA,NA,FALSE,NA,NA
1538596842,"AskSocialScience","Sanchez94","self.AskSocialScience","https://www.reddit.com/r/AskSocialScience/comments/9l4ri0/coding_with_nvivo/",1,4,NA,NA,"Coding with Nvivo","[removed]",NA,"9l4ri0",NA,0,NA,FALSE,1542552224,FALSE,"default","t5_2sml9",NA,NA,NA,FALSE,TRUE,NA,"/r/AskSocialScience/comments/9l4ri0/coding_with_nvivo/",NA,NA,FALSE,NA,NA
1540542924,"AskSocialScience","TeeeHaus","self.AskSocialScience","https://www.reddit.com/r/AskSocialScience/comments/9riy96/what_are_the_sociological_consequences_of_the/",10,38,NA,NA,"What are the sociological consequences of the internet, in regards to the structure of media and politics? And are the projections/models on how these consequences will progress? (Literature/Articles welcome)","To give some background to the question:

Thinking back to my youth and comparing it with the possibilities of the youth today, I realized that back then we got our ideas and inspirations pretty much from our circle of friends and acquaintances and to a much lesser degree from articles in newspapers, magazines and TV. Those articles and the shows we watched on TV were *either* entertainment *or* news, and nobody doubted that the news reported facts and the articles were well researched by journalists who followed a journalistic code.

Today the landscape is different. Entertainment and news are mixed, officials say that the media isnt trustworthy and anybody who can type makes a blog. In short, the information that is circulated is blurred, in the net journalists are competing with political activists and conspiracies. At the same time, everybody has access to things like wikipedia and scientific papers, and trending culture is trending everywhere without being localized to your city, for example.

I know its a huge topic, but I want to know more about these phenomenons. I did a bit of reseach into fake news, echo chambers and proliferation of information, but I am also interested in the development of society as whole. The youth growing up today have fundamentally different possibilites and face fundamentally different challenges. Are there any projections what that will mean for society, media and politics?

**TL/DR:** I want to know about the soliological consequences of the internet and, if there are any, projected changes to our social structures, especially media and politics.
",NA,"9riy96",NA,0,NA,FALSE,1542660281,FALSE,"self","t5_2sml9",NA,NA,NA,FALSE,TRUE,NA,"/r/AskSocialScience/comments/9riy96/what_are_the_sociological_consequences_of_the/",NA,NA,FALSE,NA,NA
1540562687,"AskSocialScience","AutoModerator","self.AskSocialScience","https://www.reddit.com/r/AskSocialScience/comments/9rl0lp/friday_freeforall_october_26_2018/",0,3,NA,NA,"Friday Free-for-All | October 26, 2018","This is for social science related outpourings that are not necessarily questions. Minor questions that you feel don't need or merit their own threads are welcome too. Discovered a great new book, documentary, article, or blog? Has your Ph.D. application been successful? Did you get published? Have you made an sociological discovery while at the supermarket? Did you find an anecdote about Milton Freedman telling a joke to B. F. Skinner? Tell us all about it.

Moderation in this thread will be virtually non-existent -- jokes, anecdotes, and light-hearted banter are welcome.

It's Friday, Friday. Gotta get down on Friday.",NA,"9rl0lp",NA,0,NA,FALSE,1542661257,FALSE,"self","t5_2sml9",NA,NA,NA,FALSE,TRUE,NA,"/r/AskSocialScience/comments/9rl0lp/friday_freeforall_october_26_2018/",NA,NA,FALSE,NA,"moderator"
1540571736,"AskSocialScience","Christian92","self.AskSocialScience","https://www.reddit.com/r/AskSocialScience/comments/9rmbbl/examples_of_a_new_generation_taking_over_and/",0,2,NA,NA,"Examples of a new generation taking over and changing things?","As the title says: Are there examples where a new generation takes over and changes certain things which haven't changed (much) before? Doesn't matter if it's in politics, companies, media or somewhere else.",NA,"9rmbbl",NA,0,NA,FALSE,1542661864,FALSE,"self","t5_2sml9",NA,NA,NA,FALSE,TRUE,NA,"/r/AskSocialScience/comments/9rmbbl/examples_of_a_new_generation_taking_over_and/",NA,NA,FALSE,NA,NA
